label,text
0,"the-det-protien protien-nsubj-is is-ROOT-is proccesed-advcl-is ,-punct-is then-advmod-is it-nsubj-is is-ccomp-organized separted-attr-is ,-punct-organized then-advmod-organized organized-ccomp-is ,-punct-stored then-advmod-stored it-nsubjpass-stored is-auxpass-stored stored-ccomp-organized"
0,prophase-ROOT-prophase metaphase-compound-anaphase anaphase-appos-prophase and-cc-anaphase telephase-conj-anaphase .-punct-prophase
0,-interphase-compound-prophase-metaphase-anaphase-telophase --punct-prophase-metaphase-anaphase-telophase prophase-metaphase-anaphase-telophase-ROOT-prophase-metaphase-anaphase-telophase
0,prophase-nmod-teleaphase meteaphase-nmod-teleaphase anuphase-compound-teleaphase teleaphase-ROOT-teleaphase
0,"there-expl-'s 's-ROOT-'s translation-attr-'s ,-punct-'s and-cc-'s transcription-conj-'s .-punct-'s"
0,"mrna-ROOT-mrna ,-punct-mrna trna-conj-mrna ,-punct-mrna"
1,mrna-nsubj-takes takes-ROOT-takes genetic-amod-information information-dobj-takes out-prep-takes of-prep-out the-det-cell.trna cell.trna-pobj-of brings-conj-takes amino-amod-acids acids-dobj-brings with-prep-acids complementary-amod-codons codons-pobj-with to-aux-attach attach-advcl-brings      -dobj-attach to-prep-attach the-det-balances mrna-compound-strand.trna strand.trna-compound-balances balances-pobj-to the-det-amounts chemical-amod-amounts amounts-appos-balances that-nsubj-come come-relcl-amounts with-prep-come the-det-acids amino-compound-acids acids-pobj-with .-punct-takes a-det-protein protein-nsubjpass-created is-auxpass-created created-ROOT-created with-prep-created the-det-sequence new-amod-sequence nucleotide-compound-sequence sequence-pobj-with .-punct-created
0,four-nummod-steps major-amod-steps steps-nsubj-forming are:1.them-dep-forming forming-ROOT-forming things-dobj-forming around-prep-forming them.2.they-pobj-around work-advcl-forming together.3.they-advmod-work 4-npadvmod-work .-punct-forming
0,1-meta-carried .-punct-1 the-det-protein protein-nsubjpass-carried gets-auxpass-carried carried-ROOT-carried to-prep-carried the-det-necleus2 necleus2-pobj-to .-punct-carried there-advmod-gets the-det-protein protein-nsubj-gets gets-ROOT-gets copied3-dobj-gets .-punct-gets new-amod-dna dna-nsubj-is is-ROOT-is formed4-attr-is .-punct-is the-det-protein protein-nsubjpass-used is-auxpass-used used-ROOT-used for-prep-used engergy-pobj-for
0,mrna-amod-information transfer-compound-information information-nsubjpass-required to-prep-information trna-pobj-to and-cc-information then-advmod-to to-prep-required the-det-cells main-amod-cells cells-pobj-to in-prep-cells the-det-body body-pobj-in for-mark-required the-det-signal signal-nsubjpass-required to-aux-required be-auxpass-required required-ROOT-required .-punct-required
0,"prophase-ROOT-prophase ,-punct-prophase metaphase-conj-prophase ,-punct-metaphase telophase-conj-metaphase ,-punct-telophase anaphase-conj-telophase"
0,"mrna-nsubj-turns turns-ROOT-turns into-prep-turns trna-pobj-into when-advmod-goes it-nsubj-goes goes-advcl-turns to-prep-goes the-det-er rough-compound-er er-pobj-to ,-punct-goes and-cc-turns then-advmod-gets gets-conj-turns the-det-enzymes proper-amod-enzymes enzymes-dobj-gets and-cc-gets goes-conj-gets back-advmod-goes to-prep-back the-det-nucleus nucleus-pobj-to to-aux-paired be-auxpass-paired paired-relcl-nucleus up-prt-paired with-prep-paired the-det-dna dna-pobj-with and-cc-goes replace-conj-goes the-det-stand rna-compound-stand stand-pobj-replace need-conj-goes to-aux-replaced be-auxpass-replaced replaced-xcomp-need .-punct-turns"
0,one-nummod-step step-nsubj-is is-ROOT-is that-mark-copied the-det-cells cells-nsubjpass-copied in-prep-cells mrna-pobj-in are-auxpass-copied copied-ccomp-is .-punct-is another-det-step step-nsubj-is is-ROOT-is once-mark-leaves the-det-mrna mrna-nsubj-leaves leaves-advcl-is the-det-nucleus nucleus-dobj-leaves it-nsubj-turns turns-relcl-nucleus to-prep-turns rna.a-nmod-step third-amod-step step-pobj-to is-conj-is the-det-rna rna-nsubj-changes changes-ccomp-is its-poss-sugar sugar-dobj-changes to-prep-changes ribose-pobj-to .-punct-is
0,it-nsubj-attaches attaches-ROOT-attaches on-prep-attaches to-prep-on amino-compound-acids acids-pobj-to
0,first-advmod-has the-det-mrna mrna-nsubj-has has-ROOT-has to-aux-travel travel-xcomp-has to-prep-travel the-det-end other-amod-end end-pobj-to of-prep-end the-det-body. body.-pobj-of then-advmod-has it-nsubj-has has-ROOT-has to-aux-fight fight-xcomp-has off-prep-fight the-det-invaders evil-compound-invaders space-compound-invaders invaders-pobj-off from-prep-invaders the-det-cortex. planet-compound-cortex. cortex.-pobj-from after-prep-invaders that-pobj-after is-auxpass-done done-dep-has it-nsubj-goes goes-ROOT-goes back-advmod-goes to-prep-back it-nsubj-'s 's-ccomp-goes apartment-prep-'s i-nsubj-take the-det-long vrain-nmod-long and-cc-vrain calculates-conj-vrain how-advmod-long long-advmod-take it-nsubj-take will-aux-take take-ccomp-'s to-prep-take split-pcomp-to a-det-protein protein-dobj-split in-prep-protein half.-pobj-in then-compound-there there-nsubj-is is-ROOT-is a-det-scene ninja-compound-fight fight-compound-scene scene-compound-between between-attr-is the-det-mrna mrna-pobj-between and-cc-mrna a-det-protein protein-conj-mrna which-nsubj-ends ends-relcl-protein by-prep-ends the-det-chopping mrna-compound-chopping karate-compound-chopping chopping-pobj-by the-det-protein protein-nsubj-is in-prep-protein half-npadvmod-and and-cc-is that-nsubj-is is-ROOT-is how-advmod-is protein-compound-synthesis synthesis-nsubj-is is-ccomp-is done.-attr-is
0,1-meta-goes .-punct-1 )-punct-1 when-advmod-leaves mrna-nsubj-leaves leaves-advcl-goes the-det-nucleus nucleus-dobj-leaves it-nsubj-goes goes-ROOT-goes to-prep-goes the-det-trna trna-pobj-to to-aux-deliever deliever-advcl-goes a-det-message message-dobj-deliever .-punct-goes 2-ROOT-2 .-punct-2 )-punct-2 when-advmod-gets the-det-mrna mrna-nsubj-gets gets-advcl-delievers to-prep-gets the-det-trna trna-pobj-to it-nsubj-delievers delievers-ROOT-delievers the-det-message message-dobj-delievers that-mark-needs it-nsubj-needs needs-acl-message to-prep-needs the-det-trna trna-pobj-to needs-conj-needs to-aux-carry carry-xcomp-needs the-det-instructions instructions-dobj-carry from-prep-instructions the-det-nucleus nucleus-pobj-from for-prep-instructions the-det-sequence amino-compound-sequence acid-compound-sequence sequence-pobj-for of-prep-sequence the-det-protein.3 protein.3-pobj-of .-punct-delievers )-punct-delievers then-advmod-take when-advmod-take the-det-delievers trna-nsubj-delievers delievers-nsubj-take that-nsubj-information information-relcl-delievers the-det-rrna rrna-dobj-information will-aux-take take-ROOT-take over-prt-take and-cc-take put-conj-take the-det-acids amino-compound-acids acids-dobj-put in-prep-put sequence-pobj-in  -npadvmod-put 4-nummod-  .-punct-take )-punct-take then-advmod-deliver the-det-trna trna-nsubj-deliver will-aux-deliver deliver-ROOT-deliver the-det-protein protein-dobj-deliver where-advmod-needs it-nsubj-needs needs-relcl-protein to-aux-go go-xcomp-needs .-punct-deliver
2,the-det-steps four-nummod-steps major-amod-steps steps-nsubj-are are-ROOT-are that-mark-leaves the-det-mrna mrna-nsubj-leaves leaves-ccomp-are the-det-nucleus nucleus-dobj-leaves carrying-acl-nucleus information-dobj-carrying to-aux-make make-advcl-carrying protein-dobj-make .-punct-are  -ROOT-  the-det-lands mrna-amod-lands lands-ROOT-lands on-prep-lands the-det-rrna rrna-pobj-on and-cc-lands waits-conj-lands for-mark-bring the-det-trna trna-nsubj-bring to-aux-bring bring-advcl-waits amino-amod-acids acids-dobj-bring .-punct-lands  -ROOT-  the-det-trna trna-nsubj-brings brings-ROOT-brings the-det-acids amino-compound-acids acids-dobj-brings which-advcl-brings the-det-lines mrna-compound-lines lines-nsubj-which up-prt-lines to-aux-make make-advcl-lines a-det-protein complete-amod-protein protein-dobj-make .-punct-brings
1,"after-mark-leaves mrna-nsubj-leaves leaves-advcl-go the-det-nucleus nucleus-dobj-leaves ,-punct-go the-det-mrna mrna-nsubj-go will-aux-go go-ROOT-go to-prep-go a-det-ribosome ribosome-pobj-to .-punct-go  -ROOT-  after-mark-is the-det-mrna mrna-nsubj-is is-advcl-enter at-prep-is the-det-ribosome ribosome-pobj-at ,-punct-enter it-nsubj-enter will-aux-enter enter-ROOT-enter the-det-ribosome ribosome-dobj-enter .-punct-enter  -ROOT-  after-mark-entered the-det-mrna mrna-nsubj-entered has-aux-entered entered-advcl-share the-det-ribosome ribosome-dobj-entered ,-punct-share it-nsubj-share will-aux-share share-ROOT-share the-det-information genetic-amod-information information-dobj-share it-nsubj-carrying is-aux-carrying carrying-relcl-information with-prep-carrying the-det-trna. trna.-pobj-with  -ROOT-  after-mark-has the-det-trna trna-nsubj-has has-advcl-start the-det-information genetic-amod-information information-dobj-has ,-punct-start the-det-trna trna-nsubj-start will-aux-start start-ROOT-start bringing-xcomp-start in-prt-bringing amino-compound-acids acids-dobj-bringing to-prep-bringing great-amod-proteins proteins-pobj-to .-punct-start"
0,mrna-nsubj-takes takes-ROOT-takes it-dobj-takes to-prep-takes the-det-brain brain-pobj-to .-punct-takes brain-nsubj-takes takes-ROOT-takes it-dobj-takes in-prep-takes .-punct-takes the-det-brain brain-nsubj-sends sends-ROOT-sends out-prt-sends organisms-dobj-sends to-aux-fight fight-advcl-sends it-dobj-fight .-punct-sends the-det-fighters fighters-nsubj-destroy destroy-ROOT-destroy it-dobj-destroy .-punct-destroy
1,the-det-mrna mrna-nsubj-is is-ROOT-is the-det-taken taken-ccomp-is to-aux-used be-auxpass-used used-xcomp-taken by-agent-used trna-pobj-by and-cc-trna mrna.-conj-trna then-advmod-lined it-nsubjpass-lined is-auxpass-lined lined-ROOT-lined in-prep-lined rows-pobj-in of-prep-rows codons-pobj-of .-punct-lined then-advmod-trna the-det-trna trna-ROOT-trna and-cc-trna mrna-nsubj-form form-conj-trna together-advmod-form to-aux-read read-xcomp-form and-cc-read transfer-conj-read the-det-message message-dobj-transfer for-prep-message mrna-amod-message message-pobj-for .-punct-trna this-nsubj-is is-auxpass-known all-dep-known otherwise-advmod-known known-ROOT-known as-prep-known translation-pobj-as .-punct-known
2,"1-meta-nucleus )-punct-1 mrna-compound-leaves leaves-nsubj-nucleus nucleus-ccomp-moves through-prep-nucleus a-det-pore2 nuclear-amod-pore2 pore2-pobj-through )-punct-nucleus trna-nsubj-comes comes-ccomp-moves carrying-advcl-comes the-det-codon complementary-amod-codon codon-dobj-carrying and-cc-codon amino-amod-acid3         -punct-acid3 acid3-conj-codon )-punct-acid3 as-mark-creates the-det-trna trna-nsubj-creates creates-advcl-moves amino-compound-acids acids-dobj-creates ,-punct-moves rrna-nsubj-moves moves-ROOT-moves along-prep-moves the-det-strand            -compound-strand strand-pobj-along after-mark-is each-det-acid amino-compound-acid acid-nsubj-is is-advcl-moves complete-acomp-is .-punct-moves after-mark-created a-det-acid new-amod-acid amino-compound-acid        -compound-acid acid-nsubjpass-created is-auxpass-created created-advcl-binds ,-punct-binds it-nsubj-binds binds-ROOT-binds to-prep-binds the-det-one previous-amod-one one-pobj-to ,-punct-binds forming-advcl-binds a-det-bond4 peptide-compound-bond4      -compound-bond4 bond4-dobj-forming )-punct-binds when-advmod-encounters the-det-trna trna-nsubj-encounters encounters-advcl-is a-det-codon stop-compound-codon codon-dobj-encounters ,-punct-is the-det-chain amino-compound-acid acid-compound-                       -compound-chain chain-nsubj-is is-ROOT-is complete-acomp-is"
0,then-advmod-goes the-det-mrna mrna-nsubj-goes goes-ROOT-goes to-prep-goes the-det-lysosomes lysosomes-pobj-to to-aux-produce produce-advcl-goes proteins-dobj-produce for-mark-use the-det-cell cell-nsubj-use to-aux-use use-advcl-produce .-punct-goes
0,1-ROOT-1 .-punct-1 is-ROOT-is the-det-nucleus2 nucleus2-nsubj-is .-punct-is is-ROOT-is the-det-cytoplasm3.is cytoplasm3.is-dep-is nucleouous4.core-dep-is
0,it-nsubj-makes splitsit-advmod-makes makes-ROOT-makes dna-mark-helps it-nsubj-helps helps-ccomp-makes make-xcomp-helps copies-nsubj-travels travels-dobj-make where-advmod-needed needed-relcl-travels
0,"the-det-steps four-nummod-steps major-amod-steps steps-nsubj-are involved-acl-steps in-prep-involved protein-compound-synthesis synthesis-pobj-in are-ROOT-are the-det-stages stages-attr-are of-prep-stages mitosis-pobj-of .-punct-are prophase-ROOT-prophase ,-punct-prophase metaphase-conj-prophase ,-punct-metaphase anaphase-conj-metaphase ,-punct-anaphase and-cc-anaphase telophase-conj-anaphase .-punct-prophase in-prep-work the-det-process process-pobj-in of-prep-process mitosis-pobj-of ,-punct-work the-det-parts cell-compound-parts parts-nsubj-work work-ROOT-work together-advmod-work to-aux-move move-advcl-work to-prep-move the-det-edges edges-pobj-to of-prep-edges the-det-cell cell-pobj-of ,-punct-move pull-conj-move apart-advmod-pull ,-punct-pull divide-conj-pull ,-punct-divide and-cc-divide start-conj-divide all-advmod-over over-advmod-start as-prep-start daughter-compound-cells cells-pobj-as .-punct-work"
0,mrnatrnarna-ROOT-mrnatrnarna
0,interphaseprophase-compound-metaphaseaniphase metaphaseaniphase-ROOT-metaphaseaniphase
0,step-ROOT-step 1--g1-nummod-step phasestep-nmod-4--mphase 2--sphasestep-nummod-phasestep 3--g2-nummod-4--mphase phasestep-compound-4--mphase 4--mphase-nmod-step
0,the-det-mrna mrna-nsubj-goes goes-ROOT-goes out-prep-goes of-prep-out the-det-nucleus nucleus-pobj-of and-cc-goes tell-conj-goes the-det-rna rna-dobj-tell to-aux-make make-xcomp-tell protien-dobj-make and-cc-make then-advmod-protien protien-amod-synthesis synthesis-nsubj-happens happens-ccomp-tell ...-punct-happens idk-ROOT-idk
1,1-meta-is .-punct-1 the-det-dna dna-nsubj-is is-ROOT-is '-punct-unzipped unzipped-attr-is '-punct-unzipped as-mark-broken2 the-det-bonds hydrogen-compound-bonds bonds-nsubj-broken2 are-aux-broken2 broken2-advcl-unzipped .-punct-is the-det-dna dna-nsubjpass-replicated is-auxpass-replicated replicated-ROOT-replicated on-prep-replicated each-det-side3 side3-pobj-on .-punct-replicated two-nummod-strands new-amod-strands strands-nsubj-are are-ROOT-are present-acomp-are .-punct-are
0,"prophase-ROOT-prophase ,-punct-prophase anaphase-conj-prophase ,-punct-anaphase metaphase-conj-anaphase and-cc-metaphase telophase-conj-metaphase"
0,when-advmod-leaves mrna-nsubj-leaves leaves-ROOT-leaves the-det-nucleus nucleus-dobj-leaves it-nsubj-goes goes-relcl-nucleus through-prep-goes many-amod-stages stages-pobj-through .-punct-leaves it-nsubj-passes passes-ROOT-passes through-prep-passes the-det-mitochondria mitochondria-pobj-through ...-punct-passes it-nsubj-turns turns-ROOT-turns it-dobj-turns into-prep-turns an-det-atp. atp.-pobj-into
0,"the-det-step first-amod-step step-nsubj-is is-ROOT-is mrna-nsubj-leaving leaving-ccomp-is the-det-nucleus nucleus-dobj-leaving .-punct-is then-advmod-translated ,-punct-translated the-det-instructions coded-amod-instructions instructions-nsubjpass-translated for-prep-instructions creating-pcomp-for proteins-dobj-creating are-auxpass-translated translated-ROOT-translated to-prep-translated trna.-compound-next next-pobj-to ,-punct-produced amino-amod-acids acids-nsubjpass-produced are-auxpass-produced produced-conj-translated to-aux-make make-advcl-produced the-det-protein protein-dobj-make .-punct-produced finally-advmod-combined ,-punct-combined the-det-acids amino-compound-acids acids-nsubjpass-combined are-auxpass-combined combined-ROOT-combined to-aux-make make-advcl-combined the-det-protein protein-dobj-make coded-acl-protein for-prep-coded by-agent-coded the-det-mrna mrna-pobj-by from-prep-mrna the-det-nucleus nucleus-pobj-from .-punct-combined"
0,"the-det-steps four-nummod-steps major-amod-steps steps-nsubj-gathering involved-acl-steps in-prep-involved protein-compound-synthesis synthesis-pobj-in are-aux-gathering gathering-ROOT-gathering the-det-proteins proteins-dobj-gathering ,-punct-gathering sortting-advcl-gathering them-dobj-sortting ,-punct-sortting packing-advcl-gathering them-dobj-packing ,-punct-packing and-cc-packing sending-conj-packing them-dobj-sending out-prt-sending .-punct-gathering"
0,"the-det-protein protein-nsubj-obsorb obsorb-ccomp-stored energy-dobj-obsorb from-prep-obsorb the-det-sun sun-pobj-from ,-punct-obsorb it-nsubj-produces produces-ccomp-stored sugars-dobj-produces ,-punct-sugars proteins-nsubjpass-made are-auxpass-made made-relcl-sugars ,-punct-stored energy-nsubjpass-stored is-auxpass-stored stored-ROOT-stored .-punct-stored"
0,"mrna-nsubj-leaves leaves-ROOT-leaves the-det-nucleus nucleus-dobj-leaves ,-punct-leaves carrying-advcl-leaves with-prep-carrying it-pobj-with the-det-coding coding-nsubj-recieved recieved-ccomp-carrying from-prep-recieved the-det-trna dna.-compound-trna trna-pobj-from carrying-acl-trna amino-compound-acids acids-dobj-carrying then-advmod-mitochondria mitochondria-amod-protein cytoplasm-amod-substances assembly-compound-substances substances-dobj-mitochondria protein-dobj-leaves .-punct-leaves"
0,after-mark-gives it-nsubj-gives gives-advcl-gointo its-poss-message message-dobj-gives it-nsubj-gointo will-aux-gointo gointo-ROOT-gointo the-det-body body-dobj-gointo
0,trnarrnagrnamrna-ROOT-trnarrnagrnamrna
0,mrna-aux-gose gose-ROOT-gose to-prep-gose the-det-site binding-amod-site site-pobj-to with-prep-gose the-det-insturtctions insturtctions-pobj-with for-prep-insturtctions building-pcomp-for the-det-protien protien-dobj-building .-punct-gose then-advmod-takes trna-nsubj-takes takes-ROOT-takes that-dobj-takes over-prt-takes to-prep-takes the-det-chromomes chromomes-pobj-to and-cc-takes they-nsubj-corss corss-conj-takes over-prt-corss .-punct-corss
0,"when-advmod-left the-det-step first-amod-step step-nsubj-left of-prep-step the-det-mrna mrna-pobj-of has-aux-left left-advcl-is the-det-nucleus nucleus-dobj-left ,-punct-is the-det-step second-amod-step step-nsubj-is of-prep-step this-pobj-of is-ROOT-is when-advmod-takes the-det-mitochondria mitochondria-nsubj-takes takes-advcl-is all-predet-proteins the-det-proteins proteins-dobj-takes in-prep-proteins the-det-body body-pobj-in and-cc-proteins packages-conj-takes them-dobj-packages up-prt-packages and-cc-packages ships-conj-packages them-dobj-ships somewhere-advmod-else else-advmod-ships .-punct-is then-advmod-take the-det-lysosomes lysosomes-nsubj-take take-ROOT-take the-det-protein protein-dobj-take and-cc-take keep-conj-take them-dobj-keep with-prep-keep other-amod-proteins proteins-pobj-with that-nsubjpass-packaged have-aux-packaged been-auxpass-packaged packaged-relcl-proteins .-punct-take"
0,the-det-mrna mrna-nsubj-has has-ROOT-has to-aux-chang chang-xcomp-has into-prep-chang trna-pobj-into then-advmod-has trna-nsubj-has has-conj-has to-aux-change change-xcomp-has to-prep-change rrna-pobj-to then-advmod-are the-det-codons codons-nsubj-are are-auxpass-decoded decoded-ROOT-decoded and-cc-decoded changed-conj-decoded in-prep-changed to-prep-in aminoacids-pobj-to .-punct-has
0,"after-mark-leaves the-det-mrna mrna-nsubj-leaves leaves-advcl-begins the-det-nucleus nucleus-dobj-leaves ,-punct-begins the-det-trna trna-nsubj-begins begins-ROOT-begins to-aux-transfer transfer-xcomp-begins the-det-information information-dobj-transfer to-prep-transfer the-det-rrna rrna-pobj-to to-aux-begin begin-advcl-transfer to-aux-make make-xcomp-begin a-det-strand new-amod-strand strand-dobj-make ,-punct-begins and-cc-begins then-advmod-goes it-nsubj-goes goes-conj-begins in-advmod-goes and-cc-goes looks-conj-goes for-prep-looks any-det-parts missing-amod-parts parts-pobj-for or-cc-looks if-mark-switched the-det-letters letters-nsubjpass-switched got-auxpass-switched switched-conj-looks around-advmod-switched to-aux-fix fix-advcl-switched it-dobj-fix .-punct-goes"
0,trna-ROOT-trna
0,1.it-nsubj-has has-ROOT-has to-aux-change change-xcomp-has then-advmod-thing.2.3.4 enitre-compound-thing.2.3.4 thing.2.3.4-dobj-change .-punct-has
1,they-nsubj-leave leave-ROOT-leave and-cc-leave go-conj-leave to-prep-go the-det-ribosomes ribosomes-pobj-to .-punct-leave they-nsubj-produce produce-ROOT-produce new-amod-dna dna-dobj-produce they-nsubj-send send-conj-produce it-dobj-send back-advmod-send to-prep-back the-det-nucleus nucleus-pobj-to .-punct-send they-nsubj-produce produce-ROOT-produce new-amod-dna dna-dobj-produce
0,it-nsubj-go go-ROOT-go and-cc-go gets-conj-go the-det-trna trna-dobj-gets
0,mrna-compound-transcription-rna-anabodies-codons-translation-trna --punct-transcription-rna-anabodies-codons-translation-trna transcription-rna-anabodies-codons-translation-trna-ROOT-transcription-rna-anabodies-codons-translation-trna
1,1-meta-leaves .-punct-1 mrna-nsubj-leaves leaves-ROOT-leaves the-det-cell2 cell2-dobj-leaves .-punct-leaves the-det-ribazome ribazome-nsubj-reads reads-ROOT-reads each-det-segment segment-nsubj-       -ccomp-reads 3-dobj-    .-punct-reads as-mark-read the-det-segments segments-nsubjpass-read are-auxpass-read read-advcl-come amino-compound-acids acids-nsubj-come coding-acl-acids for-prep-coding each-det-segment segment-pobj-for come-ROOT-come down-prt-come to-prep-come the-det-ribazome4 ribazome4-pobj-to .-punct-come the-det-acids amino-compound-acids acids-nsubj-attach attach-ROOT-attach to-prep-attach each-det-other other-pobj-to to-aux-form form-advcl-attach a-det-protein protein-dobj-form
1,1-meta-gives .-punct-1 the-det-mrna mrna-nsubj-gives gives-ROOT-gives the-det-code code-dative-gives tothe-compound-trna2 trna2-dobj-gives .-punct-gives the-det-trna trna-nsubj-goes goes-ROOT-goes and-cc-goes gets-conj-goes the-det-half other-amod-half half-dobj-gets of-prep-half the-det-strand dna-compound-strand3.the strand3.the-compound-strand dna-compound-strand strand-pobj-of is-auxpass-finished finished-conj-goes copying4-oprd-finished .-punct-goes the-det-molecules dna-compound-molecules molecules-nsubjpass-paired are-auxpass-paired paired-ROOT-paired with-prep-paired amino-amod-acids acids-pobj-with
0,it-nsubj-leaves leaves-ROOT-leaves the-det-nucleus nucleus-dobj-leaves .-punct-leaves it-nsubj-transfers transfers-ROOT-transfers to-prep-transfers the-det-mitochondria mitochondria-pobj-to .-punct-transfers
0,"the-det-mrna mrna-nsubj-copies copies-ROOT-copies the-det-dna dna-dobj-copies ,-punct-seperates then-advmod-seperates it-nsubj-seperates seperates-dep-copies ,-punct-seperates and-cc-seperates an-det-acid amino-compound-acid acid-nsubj-goes goes-conj-seperates through-prep-goes .-punct-copies the-det-step last-amod-step step-nsubj-is is-ROOT-is that-mark-comes it-nsubj-comes comes-ccomp-is back-advmod-together together-advmod-comes .-punct-is"
0,after-mark-leaves mrna-nsubj-leaves leaves-advcl-tells the-det-nucleus nucleus-dobj-leaves it-nsubj-tells tells-ROOT-tells the-det-rna transport-compound-rna rna-dobj-tells to-aux-bring bring-xcomp-tells nucleotides-dobj-bring to-prep-bring the-det-site active-amod-site site-pobj-to for-prep-site synthesis-pobj-for .-punct-tells  -nsubjpass-brought proteins-nsubjpass-brought and-cc-proteins amino-amod-acids acids-conj-proteins are-auxpass-brought also-advmod-brought brought-ROOT-brought to-prep-brought the-det-site active-amod-site site-pobj-to .-punct-brought  -dep-tells the-det-messenger messenger-nsubj-tells rna-nsubj-tells tells-ROOT-tells the-det-proteins existing-amod-proteins proteins-dobj-tells how-advmod-make to-aux-make make-xcomp-tells the-det-protein neccessary-amod-protein new-amod-protein protein-dobj-make and-cc-protein synthesis-nsubj-begins begins-conj-tells .-punct-begins atp-nsubj-is is-ROOT-is synthesised-attr-is and-cc-is provides-conj-is energy-dobj-provides for-prep-provides the-det-reaction reaction-pobj-for .-punct-is  -ROOT-  the-det-protein protein-nsubjpass-finished is-auxpass-finished then-advmod-finished finished-ROOT-finished and-cc-finished the-det-rna messenger-compound-rna rna-nsubj-notifies notifies-conj-finished the-det-nucleus nucleus-dobj-notifies of-prep-nucleus the-det-completion completion-pobj-of .-punct-notifies
0,the-det-mrna mrna-nsubj-leaves leaves-ROOT-leaves the-det-nucleus nucleus-dobj-leaves and-cc-leaves goes-conj-leaves to-prep-goes the-det-mitochondria mitochondria-pobj-to .-punct-leaves
0,then-advmod-get you-nsubj-get get-ROOT-get trna-dobj-get then-advmod-dna dna-appos-trna
0,protein-nsubjpass-transferred is-auxpass-transferred transferred-ROOT-transferred .-punct-transferred protein-nsubjpass-given is-auxpass-given given-ROOT-given a-det-level more-advmod-higher higher-amod-level level-dobj-given of-prep-level itself-pobj-of .-punct-given makes-ROOT-makes it-nsubj-stronger stronger-ccomp-makes .-punct-makes protein-nsubj-makes then-advmod-makes makes-ROOT-makes its-poss-way way-dobj-makes to-prep-way the-det-rna rna-pobj-to to-aux-keep keep-advcl-makes healthy-oprd-keep .-punct-makes
1,they-nsubj-go go-ROOT-go through-prep-go transcription-pobj-through .-punct-go the-det-dna dna-nsubj-splits splits-ROOT-splits into-prep-splits to-prep-splits so-advmod-unwinds it-nsubj-unwinds unwinds-ROOT-unwinds its-poss-self self-dobj-unwinds and-cc-self splits-conj-self .-punct-unwinds now-advmod-has its-poss-mrna mrna-dep-has and-cc-mrna it-nsubj-has has-ROOT-has to-aux-split split-xcomp-has to-aux-fit fit-xcomp-split through-prep-fit the-det-way passage-compound-way way-pobj-through out-prep-way of-prep-out the-det-nucleus nucleus-pobj-of .-punct-has then-advmod-foes it-nsubj-foes foes-ROOT-foes down-prt-foes into-prep-foes the-det-ribosomes ribosomes-pobj-into .-punct-foes here-advmod-uses it-nsubj-uses uses-ROOT-uses translation-dobj-uses and-cc-translation copies-conj-translation itsleft-dobj-copies into-prep-itsleft dna-pobj-into again-advmod-copies and-cc-uses makes-conj-uses protines-dobj-makes .-punct-uses the-det-mrna mrna-nsubj-carries carries-ROOT-carries intructions-dobj-carries for-prep-carries dna.-pobj-for
