label,text
1,"the-det-mrna mrna-nsubj-travels travels-ROOT-travels to-prep-travels the-det-ribosomes ribosomes-pobj-to .-punct-travels at-prep-copied the-det-ribosomes ribosomes-pobj-at the-det-mrna mrna-nsubjpass-copied is-auxpass-copied copied-ROOT-copied so-advmod-is that-nsubj-is is-conj-copied can-aux-used be-auxpass-used used-ccomp-is to-aux-create create-xcomp-used proteins-dobj-create .-punct-is the-det-copies copies-nsubjpass-used mrna-nsubjpass-used is-auxpass-used then-advmod-used used-ROOT-used as-prep-used instructions-pobj-as to-aux-create create-acl-instructions proteins-dobj-create .-punct-used the-det-proteins proteins-nsubjpass-made are-auxpass-made made-ROOT-made ,-punct-made using-advcl-made the-det-instructions instructions-dobj-using given-acl-instructions .-punct-made"
0,atp-nsubjpass-created is-auxpass-created created-ROOT-created and-cc-created broken-conj-created down-prt-broken .-punct-created it-nsubjpass-broken is-auxpass-broken broken-ROOT-broken down-prt-broken when-advmod-connect 2-nummod-groups phosphate-compound-groups groups-nsubj-connect do-aux-connect n't-neg-connect connect-advcl-broken with-prep-connect the-det-adp.adp third-amod-adp.adp causing-amod-adp.adp adp.adp-pobj-with can-aux-make make-conj-broken atp-dobj-make again-advmod-make by-prep-make remaking-pcomp-by itself-dobj-remaking .-punct-broken
0,the-det-mrna mrna-nsubj-gets first-advmod-gets gets-ROOT-gets on-prep-gets an-det-chain electron-amod-chain transport-compound-chain chain-pobj-on .-punct-gets
0,"the-det-mrna mrna-nsubj-travels then-advmod-travels travels-ROOT-travels to-prep-travels the-det-mitochondria mitochondria-pobj-to ,-punct-mitochondria where-advmod-copied it-nsubjpass-copied is-auxpass-copied then-advmod-copied copied-relcl-mitochondria .-punct-travels then-advmod-goes one-nummod-mrna mrna-nsubj-goes goes-ROOT-goes to-prep-goes the-det-nucleus nucleus-pobj-to while-mark-goes the-det-other other-nsubj-goes goes-advcl-goes to-prep-goes the-det-ribosomes ribosomes-pobj-to ,-punct-ribosomes where-advmod-transfers it-nsubj-transfers transfers-relcl-ribosomes its-poss-infornmation infornmation-dobj-transfers to-prep-transfers the-det-organelle organelle-pobj-to .-punct-goes the-det-organelle organelle-nsubj-reads then-advmod-reads reads-ROOT-reads the-det-infornmation infornmation-dobj-reads and-cc-reads makes-conj-reads proteins-dobj-makes .-punct-reads"
2,"first-amod-thing thing-nsubj-is the-det-mrna mrna-nsubj-does does-relcl-thing is-ROOT-is go-xcomp-is to-prep-go the-det-ribosome ribosome-pobj-to .-punct-is  -intj-comes next-advmod-comes ,-punct-comes the-det-trna trna-nsubj-comes comes-ROOT-comes and-cc-comes decodes-conj-comes the-det-nucleotides first-amod-nucleotides three-nummod-nucleotides nucleotides-dobj-decodes .-punct-comes  -ROOT-  then-advmod-brings ,-punct-brings the-det-trna trna-nsubj-brings brings-ROOT-brings over-prt-brings the-det-acid amino-compound-acid acid-dobj-brings that-nsubj-matches matches-relcl-acid the-det-codon codon-dobj-matches .-punct-brings  -ROOT-  last-amod-form ,-punct-shifts the-det-shifts trna-nsubj-shifts shifts-nsubj-form over-prep-shifts and-cc-shifts the-det-acids amino-compound-acids acids-conj-shifts form-ROOT-form peptide-compound-bonds bonds-dobj-form with-prep-bonds one-pobj-with another-det-one .-punct-form"
1,goes-ROOT-goes to-prep-goes the-det-golgi er-intj-golgi then-advmod-golgi golgi-pobj-to bodys-dep-golgi
0,"messenger-compound-rna rna-nsubj-collect collect-ROOT-collect  -mark-comes the-det-protein protein-nsubj-particals particals-ccomp-  inside-prep-particals the-det-nucleus nucleus-pobj-inside of-prep-nucleus the-det-cell cell-pobj-of the-det-rna the-det-rna transport-compound-rna rna-nsubj-comes comes-ccomp-collect by-advmod-comes to-aux-collect collect-advcl-comes those-det-prteins prteins-dobj-collect in-prep-collect that-det-cell cell-pobj-in and-cc-comes takes-conj-comes them-dobj-takes to-prep-takes anothe-det-rcell rcell-pobj-to in-prep-rcell the-det-body body-pobj-in so-mark-absorb that-mark-absorb ,-punct-absorb that-det-part part-nsubj-absorb of-prep-part the-det-body body-pobj-of can-aux-absorb absorb-advcl-takes those-det-protein protein-dobj-absorb and-cc-absorb use-conj-absorb tem-dobj-use in-prep-use the-det-function function-pobj-in of-prep-function protein-pobj-of sythesis-conj-use .-punct-collect"
0,translation--nsubj-is the-det-code amino-compound-code acid-compound-code code-nsubj-is is-ROOT-is translatedtranscription--punct-is the-det-code amino-compound-code acid-compound-code code-nsubj-is is-ccomp-is readsynthesis-attr-is --punct-readsynthesis the-det-protein protein-nsubjpass-made is-auxpass-made made-ROOT-made introduction--oprd-made the-det-code code-nsubjpass-given is-auxpass-given given-ROOT-given
0,1-ROOT-1 .-punct-1 the-det-mrna mrna-nsubj-takes takes-ROOT-takes the-det-information copied-amod-information information-dobj-takes out-prt-takes into-prep-takes the-det-cytoplasm.2 cytoplasm.2-pobj-into .-punct-takes there-advmod-brings trna-nsubj-brings brings-ROOT-brings in-prt-brings nucleotides-dobj-brings to-aux-pair pair-advcl-brings up-prt-pair with-prep-pair the-det-inorder mrna-compound-inorder inorder-pobj-with to-aux-make make-advcl-pair a-det-copy copy-dobj-make of-prep-copy the-det-strand.3 dna-compound-strand.3 strand.3-pobj-of .-punct-brings an-det-acid amino-compound-acid acid-nsubjpass-paired is-auxpass-paired then-advmod-paired paired-ROOT-paired up-prt-paired with-prep-paired each-det-set set-pobj-with of-prep-set three-nummod-nucleotides.4 nucleotides.4-pobj-of .-punct-paired once-mark-completed the-det-process process-nsubjpass-completed is-auxpass-completed completed-advcl-used it-nsubjpass-used is-auxpass-used used-ROOT-used to-aux-make make-xcomp-used a-det-protein protein-dobj-make .-punct-used
1,first-advmod-leaves the-det-mrna mrna-nsubj-leaves leaves-ROOT-leaves the-det-nucleus cell-compound-nucleus nucleus-dobj-leaves and-cc-nucleus moves-conj-nucleus to-prep-moves the-det-ribosome ribosome-pobj-to where-advmod-finds trna-nsubj-finds finds-relcl-ribosome complementary-amod-bases bases-dobj-finds
0,"the-det-mrna mrna-nsubj-brings brings-ROOT-brings the-det-protein protein-dobj-brings to-prep-brings another-det-place place-pobj-to in-prep-place the-det-cell cell-pobj-in ,-punct-brings via-prep-brings the-det-apperatus golgi-compound-apperatus apperatus-pobj-via .-punct-brings an-det-forms amino-amod-forms acid-compound-forms forms-ROOT-forms the-det-protein protein-dobj-forms .-punct-forms the-det-protein protein-nsubj-begins begins-ROOT-begins to-aux-form form-xcomp-begins in-prep-form the-det-reticlium smooth-amod-reticlium endoplasmic-amod-reticlium reticlium-pobj-in .-punct-begins the-det-protein protein-nsubjpass-refined is-auxpass-refined refined-ROOT-refined in-prep-refined the-det-reticlium rough-amod-reticlium endoplasmic-compound-reticlium reticlium-pobj-in .-punct-refined"
1,"mrna-nsubj-leaves leaves-ROOT-leaves the-det-nucleus  -amod-nucleus nucleus-dobj-leaves .-punct-leaves then-advmod-enters it-nsubj-enters enters-ROOT-enters the-det-cytoplam cytoplam-dobj-enters ,-punct-enters and-cc-enters proceeds-conj-enters to-prep-proceeds the-det-er. er.-pobj-to"
1,"1-ROOT-1 .-punct-1 the-det-mrna mrna-nsubj-leaves leaves-ROOT-leaves the-det-nucleus.2 nucleus.2-dobj-leaves .-punct-leaves the-det-mrna mrna-nsubj-transports transports-ROOT-transports to-prep-transports the-det-reticulum.3 reticulum.3-pobj-to .-punct-transports the-det-mrna mrna-nsubj-hooks hooks-ROOT-hooks onto-prep-hooks a-det-dna.4 dna.4-pobj-onto .-punct-hooks the-det-mrna mrna-nsubjpass-transported is-auxpass-transported transported-ROOT-transported by-agent-transported the-det-trna trna-pobj-by back-advmod-transported to-prep-back the-det-nucleus nucleus-pobj-to ,-punct-transported"
0,"anaphase-ROOT-anaphase ,-punct-anaphase metaphase-conj-anaphase ,-punct-metaphase prophase-conj-metaphase ,-punct-prophase telophase-conj-prophase"
3,"four-nummod-steps major-amod-steps steps-nsubj-are involved-acl-steps in-prep-involved protein-compound-synthesis synthesis-pobj-in are-ROOT-are as-mark-follows follows-advcl-enters ,-punct-enters mrna-nsubj-enters enters-ccomp-are a-det-ribosome ribosome-dobj-enters .-punct-are then-advmod-delivers ,-punct-delivers trna-nsubj-delivers delivers-ROOT-delivers amino-amod-acids acids-dobj-delivers to-prep-delivers the-det-ribosome ribosome-pobj-to .-punct-delivers the-det-codon mrna-compound-codon codon-nsubj-matches matches-ROOT-matches with-prep-matches the-det-codon trna-nmod-codon anti-amod-codon --punct-codon codon-pobj-with .-punct-matches also-advmod-joined ,-punct-joined the-det-acids amino-compound-acids acids-nsubjpass-joined are-auxpass-joined joined-ROOT-joined by-agent-joined a-det-reaction condensation-compound-reaction reaction-pobj-by .-punct-joined this-det-process process-nsubjpass-repeated is-auxpass-repeated repeated-ROOT-repeated until-mark-reached a-det-code stop-compound-code code-nsubjpass-reached is-auxpass-reached reached-advcl-repeated .-punct-repeated"
1,1.the-nsubj-sends mrna-nsubj-sends sends-ROOT-sends a-det-message message-dobj-sends to-dative-sends ribosomes-pobj-to to-aux-send send-advcl-sends anticodons.2-dobj-send .-punct-sends the-det-anticodons anticodons-nsubj-place place-ROOT-place themselves-dobj-place on-prep-place the-det-portion matching-compound-portion portion-pobj-on of-prep-portion the-det-strand.3 mrna-compound-strand.3 strand.3-pobj-of .-punct-place the-det-ribosomes ribosomes-nsubj-begin begin-ROOT-begin to-aux-create create-xcomp-begin proteins.4-dobj-create .-punct-begin the-det-strand opposite-amod-strand rna-compound-strand strand-nsubjpass-created of-prep-strand the-det-mrna original-amod-mrna mrna-pobj-of is-auxpass-created created-ROOT-created .-punct-created
0,"prophase-ROOT-prophase ,-punct-prophase metaphase-conj-prophase ,-punct-metaphase anaphase-conj-metaphase ,-punct-anaphase telophase-conj-anaphase"
0,it-nsubj-sends sends-ROOT-sends instructions-dobj-sends for-prep-instructions the-det-sequence amino-compound-sequence acid-compound-sequence sequence-pobj-for if-prep-sends a-det-protein protein-pobj-if .-punct-sends
1,"the-det-mrna mrna-nsubj-trvales trvales-ROOT-trvales through-prep-trvales the-det-cytoplasm cytoplasm-pobj-through ,-punct-enters then-advmod-enters enters-dep-trvales the-det-ribosome ribosome-dobj-enters ,-punct-decodes then-advmod-decodes the-det-ribosome ribosome-nsubj-decodes decodes-dep-trvales the-det-acids amino-compound-acids acids-dobj-decodes ,-punct-decodes and-cc-decodes then-advmod-leaves the-det-mrna mrna-nsubj-leaves leaves-conj-decodes the-det-ribosome ribosome-dobj-leaves and-cc-ribosome the-det-ribosome ribosome-nsubj-makes makes-conj-leaves more-dobj-makes of-prep-more that-det-codon codon-pobj-of .-punct-leaves"
0,mrna--amod-rna messenger-compound-rna rna-nsubj-send where-advmod-send it-nsubj-send send-ROOT-send messages-compound-throughout throughout-dobj-send the-det-rna cellrrna--compound-rna ribosomal-compound-rna rna-nsubj-is is-conj-send where-advmod-is ribosomes-compound-make make-compound-protienstrna- protienstrna--nsubj-is transfer-prep-protienstrna- rna-compound-where where-conj-protienstrna- is-advcl-is transfers-attr-is the-det-proteins proteins-appos-transfers
0,ribsomesnucleusanaphasemoonchadrion-ROOT-ribsomesnucleusanaphasemoonchadrion
0,protein-compound-synthesis synthesis-nsubjpass-needed is-auxpass-needed needed-ROOT-needed in-prep-needed your-poss-body body-pobj-in because-prep-needed of-pcomp-because the-det-proteins proteins-pobj-because .-punct-needed the-det-steps four-nummod-steps major-amod-steps steps-nsubj-are are-ROOT-are when-advmod-occurs it-nsubj-occurs occurs-advcl-are in-prep-occurs the-det-body body-pobj-in and-cc-occurs when-advmod-uses your-poss-body body-nsubj-uses uses-conj-occurs the-det-protien protien-dobj-uses .-punct-are
0,"once-mark-leaves mrna-nsubj-leaves leaves-advcl-travels the-det-nucleus nucleus-dobj-leaves ,-punct-travels it-nsubj-travels travels-ROOT-travels to-prep-travels the-det-cells other-amod-cells cells-pobj-to in-prep-started which-pobj-in the-det-protein protein-nsubjpass-started is-auxpass-started started-relcl-cells to-aux-made be-auxpass-made made-xcomp-started .-punct-travels by-prep-formed the-det-end end-pobj-by of-prep-end the-det-journey mrnas-amod-journey journey-pobj-of ,-punct-formed protein-nsubjpass-formed is-auxpass-formed formed-ROOT-formed .-punct-formed"
0,"the-det-dna dna-nsubj-begins then-advmod-begins begins-ROOT-begins to-aux-reproduce reproduce-xcomp-begins ,-punct-begins  -nsubj-takes then-advmod-takes mitosis-nsubj-takes takes-conj-begins place-dobj-takes ,-punct-takes then-advmod-is the-det-spring off-amod-spring spring-nsubj-is is-conj-begins present-acomp-is .-punct-is"
0,the-det-mrna mrna-nsubj-exits exits-ROOT-exits the-det-nucleus nucleus-dobj-exits and-cc-exits enters-conj-exits the-det-cytoplasm cytoplasm-dobj-enters of-prep-cytoplasm the-det-cell cell-pobj-of .-punct-exits ribisome-nsubj-produce produce-ROOT-produce proteins-dobj-produce according-prep-produce to-prep-according the-det-directions directions-pobj-to on-prep-directions the-det-mrna.the mrna.the-pobj-on produced-amod-proteins proteins-nsubjpass-arranged are-auxpass-arranged arranged-conj-produce in-prep-arranged the-det-order order-pobj-in described-acl-order by-agent-described the-det-proteins rna.they-compound-proteins proteins-pobj-by go-conj-produce through-prep-go the-det-reticulum rough-amod-reticulum endoplasmic-amod-reticulum reticulum-pobj-through for-prep-reticulum further-amod-modification modification-pobj-for .-punct-produce
3,"when-advmod-leaves the-det-mrna mrna-nsubj-leaves leaves-advcl-fits the-det-nucleus nucleus-dobj-leaves ,-punct-fits it-nsubj-fits fits-ROOT-fits through-prep-fits the-det-holes holes-pobj-through by-prep-fits virtue-pobj-by of-prep-virtue being-pcomp-of single-amod-stranded --punct-stranded stranded-acomp-being .-punct-fits the-det-mrna mrna-nsubj-floats floats-ROOT-floats around-advmod-floats until-mark-encounters it-nsubj-encounters encounters-advcl-floats a-det-ribosome ribosome-dobj-encounters .-punct-floats the-det-ribosome ribosome-nsubj-latches latches-ROOT-latches on-prep-latches to-prep-on the-det-mrna mrna-pobj-to with-prep-latches the-det-portion larger-amod-portion portion-nsubj-nesting nesting-pcomp-with with-prep-nesting and-cc-nesting reading-conj-nesting three-nummod-bases nitrogenous-compound-bases bases-dobj-reading ,-punct-called called-conj-latches a-det-codon codon-oprd-called ,-punct-called at-prep-called a-det-time time-pobj-at .-punct-latches the-det-ribosome ribosome-nsubj-says says-ROOT-says in-prep-says semi-compound-stasis --punct-stasis stasis-pobj-in until-prep-says a-det-trna trna-pobj-until with-prep-trna the-det-bases proper-amod-bases corresponding-amod-bases nitrogenous-compound-bases bases-nsubj-bumps bumps-relcl-trna into-prep-bumps it-pobj-into .-punct-says the-det-trna trna-nsubjpass-held is-auxpass-held held-ROOT-held by-agent-held the-det-ribosome ribosome-pobj-by until-mark-read the-det-codon second-amod-codon codon-nsubjpass-read has-aux-read been-auxpass-read read-advcl-held ,-punct-read and-cc-read a-det-trna second-amod-trna trna-nsubjpass-bonded is-auxpass-bonded bonded-conj-read to-prep-bonded by-agent-bonded the-det-ribosome ribosome-pobj-by .-punct-held a-det-peptide peptide-nsubj-is (-punct-peptide dehydration-compound-synthesis synthesis-appos-peptide )-punct-peptide bond-compound-forms forms-nsubj-is between-prep-forms the-det-acids two-nummod-acids amino-amod-acids acids-pobj-between ,-punct-forms and-cc-forms the-det-trna initial-amod-trna trna-conj-forms is-ROOT-is '-punct-is cut-xcomp-is loose-advmod-cut '-punct-is the-det-ribosome ribosome-nsubj-moves then-advmod-moves moves-ROOT-moves on-prep-moves down-prep-moves the-det-mrna mrna-nsubj-creating creating-advcl-moves the-det-protein protein-dobj-creating coded-acl-protein for-prep-coded .-punct-moves a-det-strand strand-nsubjpass-translated of-prep-strand mrna-pobj-of can-aux-translated be-auxpass-translated translated-ROOT-translated several-amod-times times-npadvmod-translated .-punct-translated"
0,1-nummod-mitosis2 .-punct-1 mitosis2-ROOT-mitosis2 .-punct-mitosis2 meiosis3-ROOT-meiosis3 .-punct-meiosis3 dna-compound-extraction4 extraction4-ROOT-extraction4 .-punct-extraction4 blood-compound-transfer transfer-ROOT-transfer
0,1-meta-leaves )-punct-1 mrna-nsubj-leaves leaves-ROOT-leaves the-det-nucleus nucleus-dobj-leaves on-prep-leaves a-det-strand.2 dna-compound-strand.2 strand.2-pobj-on )-punct-leaves ribosomes-nsubj-produce produce-ROOT-produce proteins.3-dobj-produce )-punct-produce ribosomes-nsubj-carry then-advmod-carry carry-ROOT-carry the-det-proteins proteins-dobj-carry to-prep-carry the-det-reticulum.4 rough-compound-reticulum.4 endoplasmic-compound-reticulum.4 reticulum.4-pobj-to )-punct-carry there-advmod-synthesized the-det-proteins proteins-nsubjpass-synthesized are-auxpass-synthesized synthesized-ROOT-synthesized .-punct-synthesized
1,once-mark-leaves the-det-mrna mrna-nsubj-leaves leaves-ROOT-leaves the-det-nucleus nucleus-dobj-leaves it-nsubj-has has-relcl-nucleus to-aux-make make-xcomp-has another-det-kind kind-dobj-make of-prep-kind rna-pobj-of to-aux-transfer transfer-relcl-kind the-det-information information-dobj-transfer to-prep-transfer the-det-parts other-amod-parts parts-pobj-to of-prep-parts the-det-cells cells-pobj-of and-cc-parts the-det-body body-conj-parts .-punct-leaves the-det-codons codons-nsubjpass-matched of-prep-codons the-det-rna messenger-compound-rna rna-pobj-of are-auxpass-matched matched-ROOT-matched up-prt-matched with-prep-matched their-poss-codons codons-pobj-with for-prep-matched a-det-transfer transfer-pobj-for rna.-appos-transfer the-det-transfer transfer-nsubjpass-made rna-nsubjpass-made is-auxpass-made made-ROOT-made and-cc-made can-aux-continue then-advmod-continue continue-conj-made to-aux-do do-xcomp-continue its-poss-job job-dobj-do while-mark-copied more-amod-transfer transfer-compound-rnas rnas-nsubjpass-copied are-aux-copied being-auxpass-copied copied-advcl-continue .-punct-made then-advmod-go the-det-rnas rnas-nsubj-go can-aux-go go-ROOT-go to-prep-go the-det-ribosomes ribosomes-pobj-to and-cc-go give-conj-go them-dative-give the-det-message message-dobj-give to-aux-make make-acl-message more-amod-proteins proteins-dobj-make .-punct-go
2,"1-ROOT-1 .-punct-1 the-det-mrna mrna-nsubj-attaches attaches-ROOT-attaches to-prep-attaches a-det-ribosome ribosome-pobj-to ,-punct-attaches to-aux-begin begin-xcomp-attaches protein-compound-synthesis.2 synthesis.2-dobj-begin .-punct-attaches the-det-acid correct-amod-acid amino-compound-acid acid-nsubj-attaches attaches-ROOT-attaches to-prep-attaches the-det-part first-amod-part part-pobj-to of-prep-part the-det-mrna mrna-pobj-of in-prep-mrna the-det-site p-compound-site --punct-site site-pobj-in ,-punct-attaches while-mark-waits.3 in-prep-waits.3 the-det-site a-nmod-site --punct-site site-pobj-in another-det-waits.3 amino-compound-acid acid-compound-waits.3 waits.3-advcl-attaches .-punct-attaches the-det-ribosome ribosome-nsubj-keeps keeps-ROOT-keeps moving-xcomp-keeps intil-prep-moving a-det-codon stop-amod-codon codon-nsubjpass-reached is-auxpass-reached reached-conj-keeps and-cc-reached stops-conj-reached .-punct-reached"
0,the-det-mrna mrna-nsubj-leaves leaves-ROOT-leaves the-det-cell cell-dobj-leaves cell-nsubj-makes makes-conj-leaves protienmrna-compound-bings bings-dobj-makes it-nsubj-back back-advmod-makes cell-nsubj-uses uses-conj-makes it-dobj-uses .-punct-uses
0,1-ROOT-1 .-punct-1 mrna-nsubj-leave will-aux-leave leave-ROOT-leave the-det-nucleus.2 nucleus.2-dobj-leave .-punct-leave it-nsubj-find will-aux-find find-ROOT-find a-det-chromosome chromosome-dobj-find then-advmod-attach attach-conj-find to-prep-attach it.3-pobj-to .-punct-find it-nsubj-go will-aux-go then-advmod-go go-ROOT-go through-prep-go codons-pobj-through before-prep-go adding-pcomp-before on-prt-adding to-prep-adding it.4-pobj-to .-punct-go
0,"the-det-step first-amod-step major-amod-step step-nsubj-is involved-acl-step in-prep-involved protein-compound-synthesis synthesis-pobj-in is-ROOT-is mrna-attr-is leaving-advcl-is the-det-nucleus nucleus-dobj-leaving .-punct-is when-advmod-leaves the-det-mrna mrna-nsubj-leaves leaves-advcl-takes the-det-nucleus nucleus-dobj-leaves ,-punct-takes it-nsubj-takes takes-ROOT-takes the-det-sequence amino-compound-sequence acid-compound-sequence sequence-dobj-takes back-advmod-takes to-prep-back the-det-protein protein-pobj-to which-nsubj-results then-advmod-results results-relcl-protein in-prep-results the-det-step second-amod-step major-amod-step step-pobj-in which-nsubj-is is-relcl-step passive-amod-transport transport-attr-is .-punct-takes passive-amod-transport transport-nsubj-brings brings-ROOT-brings proteins-dobj-brings in-prep-proteins and-cc-in out-conj-in of-prep-out the-det-cell cell-pobj-of .-punct-brings the-det-step third-amod-step step-nsubj-is is-ROOT-is the-attr-is when-advmod-making the-det-mitocondria mitocondria-nsubj-making is-aux-making making-advcl-the its-poss-way way-dobj-making to-aux-help help-advcl-making out-prt-help the-det-cells other-amod-cells cells-dobj-help with-prep-help the-det-synthesis protein-compound-synthesis synthesis-pobj-with .-punct-is the-det-step last-amod-step step-nsubj-is is-ROOT-is when-advmod-making the-det-protein protein-nsubj-making is-aux-making making-advcl-is its-poss-way way-dobj-making back-advmod-way to-prep-back where-advmod-suppost is-auxpass-suppost suppost-pcomp-to to-aux-go go-xcomp-suppost ,-punct-making resulting-advcl-making in-prep-resulting protein-compound-synthesis synthesis-pobj-in .-punct-is"
0,"cells-nsubj-know are-dep-know know-ROOT-know to-aux-use use-xcomp-know many-amod-things things-dobj-use in-prep-use cell-compound-mvment mvment-pobj-in such-amod-as as-prep-use mrna.-pobj-as they-nsubj-use also-advmod-use use-conj-know trna,nrna.-dobj-use"
1,"there-expl-steps four-nummod-steps major-amod-steps steps-ROOT-steps of-prep-steps protien-compound-synthesis synthesis-pobj-of .-punct-steps the-det-first first-nsubj-is is-aux-going the-det-mrna mrna-nsubj-going going-ROOT-going to-prep-going the-det-rrna. rrna.-pobj-to then-advmod-takes the-det-rrna rrna-nsubj-takes takes-ROOT-takes the-det-information information-dobj-takes from-prep-takes the-det-mrna mrna-pobj-from to-prep-takes the-det-trna. trna.-pobj-to next-mark-take the-det-trna trna-nsubj-take will-aux-take take-advcl-takes the-det-information information-dobj-take it-nsubj-has has-relcl-information and-cc-take translate-conj-take it-dobj-translate .-punct-takes lastly-advmod-take ,-punct-take the-det-trna trna-nsubj-take will-aux-take take-ROOT-take the-det-information information-dobj-take and-cc-take make-conj-take a-det-protein protein-dobj-make .-punct-take"
0,mrna-nsubj-tell tell-ROOT-tell instructions-dobj-tell to-prep-instructions the-det-messenger messenger-pobj-to trna-nsubj-makes makes-ccomp-tell proteins-dobj-makes and-cc-proteins oxygen-conj-proteins and-cc-oxygen hydrogen-conj-oxygen
1,"1-meta-leaves .-punct-1 mrna-nsubj-leaves leaves-ROOT-leaves the-det-nucleus nucleus-dobj-leaves and-cc-leaves travels-conj-leaves to-prep-travels the-det-ribosomes.2 ribosomes.2-pobj-to .-punct-leaves once-advmod-turned in-prep-once the-det-ribosomes ribosomes-pobj-in ,-punct-turned the-det-mrna mrna-nsubjpass-turned gets-auxpass-turned turned-ROOT-turned into-prep-turned trna.3-pobj-into .-punct-turned the-det-trna trna-nsubjpass-gathered is-auxpass-gathered gathered-ROOT-gathered by-agent-gathered the-det-ribosomes ribosomes-pobj-by to-aux-see see-advcl-gathered what-det-is.4 the-det-is.4 amino-compound-sequence acid-compound-sequence sequence-compound-is.4 is.4-ccomp-see .-punct-gathered the-det-things right-amod-things things-nsubjpass-given are-auxpass-given given-ROOT-given to-dative-given the-det-cell cell-pobj-to to-aux-make make-advcl-given proteins-dobj-make .-punct-given"
0,the-det-mrna mrna-nsubjpass-copied is-auxpass-copied copied-ROOT-copied and-cc-copied the-det-strand coped-amod-strand strand-nsubjpass-taken is-auxpass-taken taken-conj-copied to-prep-taken the-pobj-to
0,"first-advmod-starting starting-advcl-goes at-prep-starting the-det-mrna mrna-pobj-at it-nsubj-goes goes-ROOT-goes to-prep-goes trna-pobj-to ,-punct-trna which-nsubj-transfers transfers-relcl-trna it-dobj-transfers to-prep-transfers rrna-pobj-to and-cc-transfers then-advmod-grna grna-conj-transfers"
1,mrna-nsubj-leaves leaves-ROOT-leaves the-det-nuleus nuleus-dobj-leaves and-cc-leaves carries-conj-leaves instructions-dobj-carries for-prep-instructions amino-compound-acid acid-compound-sequence sequence-pobj-for of-prep-sequence a-det-protien protien-pobj-of to-prep-protien the-det-ribosomes ribosomes-pobj-to where-advmod-helps it-nsubj-helps helps-advcl-carries code-xcomp-helps the-det-acid amino-compound-acid acid-dobj-code and-cc-helps makes-conj-helps the-det-protien protien-dobj-makes .-punct-leaves
0,"after-mark-leaves the-det-mrna mrna-nsubj-leaves leaves-ROOT-leaves the-det-nucleus nucleus-dobj-leaves it-nsubj-takes takes-relcl-nucleus the-det-sequence sequence-dobj-takes to-prep-takes the-det-cytoplasm cytoplasm-pobj-to .-punct-leaves then-advmod-transports the-det-rrna rrna-nsubj-transports transports-ROOT-transports it-dobj-transports to-prep-transports to-prep-to the-det-trna. trna.-pobj-to  -npadvmod-transports then-advmod-takes the-det-trna trna-nsubj-takes takes-ROOT-takes it-dobj-takes to-prep-takes the-det-sequence opposite-amod-sequence sequence-pobj-to of-prep-sequence dna-pobj-of ,-punct-dna where-advmod-completed the-det-process process-nsubjpass-completed is-auxpass-completed completed-relcl-dna .-punct-takes"
