label,text
1,the-det-mrna mrna-nsubj-goes goes-ROOT-goes to-prep-goes the-det-ribsosomes ribsosomes-pobj-to .-punct-goes the-det-ribsosomes ribsosomes-nsubj-make make-ROOT-make a-det-templet.trna templet.trna-nsubj-finds finds-ccomp-goes the-det-parts parts-dobj-finds to-aux-make make-advcl-finds the-det-protiensmrna protiensmrna-nsubj-goes goes-ccomp-make with-prep-goes the-det-ribsosomes ribsosomes-pobj-with to-aux-make make-advcl-goes the-det-protiens protiens-dobj-make
1,"mrna-nsubj-leaves leaves-ccomp-start the-det-nucleus nucleus-dobj-leaves and-cc-leaves travels-conj-leaves to-prep-travels the-det-ribosomes ribosomes-pobj-to and-cc-travels tells-conj-travels them-dobj-tells to-aux-make make-xcomp-tells proteins-dobj-make ,-punct-start the-det-ribosomes ribosomes-nsubj-start then-advmod-start start-ROOT-start to-aux-create create-xcomp-start the-det-proteins proteins-dobj-create ,-punct-proteins which-nsubjpass-transfered are-auxpass-transfered then-advmod-transfered transfered-relcl-proteins to-prep-transfered the-det-nucleus nucleus-pobj-to to-aux-programmed be-auxpass-programmed programmed-relcl-nucleus for-prep-programmed whatever-dobj-needed they-nsubjpass-needed are-auxpass-needed needed-pcomp-for for-prep-needed .-punct-start"
0,"mrna-nsubj-leaves leaves-ccomp-has the-det-nucleus nucleus-dobj-leaves ,-punct-has it-nsubj-has then-advmod-has has-ccomp-splits to-aux-reproduce reproduce-xcomp-has ,-punct-splits it-nsubj-splits splits-ROOT-splits to-aux-make make-xcomp-splits a-det-copy copy-dobj-make ,-punct-splits and-cc-splits then-advmod-has the-det-mrna mrna-nsubj-has has-conj-splits to-aux-synthesis synthesis-xcomp-has further-advmod-synthesis to-aux-make make-advcl-synthesis protein-compound-synthesis synthesis-nsubj-complete complete-ccomp-make .-punct-has"
0,the-det-mrna mrna-nsubj-creates leaving-acl-mrna the-det-nucleus nucleus-dobj-leaving creates-ROOT-creates a-det-structure structure-dobj-creates for-prep-structure the-det-proteins proteins-pobj-for to-aux-leave leave-xcomp-creates the-det-cell cell-dobj-leave .-punct-creates then-advmod-leave the-det-proteins proteins-nsubj-leave leave-ROOT-leave the-det-cell cell-dobj-leave .-punct-leave after-prep-works this-pobj-after the-det-cell cell-nsubj-works works-ROOT-works to-aux-make make-advcl-works new-amod-proteins proteins-dobj-make .-punct-works then-advmod-keeps the-det-process process-nsubj-keeps keeps-ROOT-keeps repeating-xcomp-keeps .-punct-keeps
2,"1-meta-take )-punct-1 the-det-mrna mrna-nsubj-take will-aux-take take-ROOT-take the-det-code genetic-amod-code code-dobj-take to-prep-take a-det-ribosome.2 ribosome.2-pobj-to )-punct-take trna-nsubj-comes comes-ROOT-comes to-prep-comes the-det-ribosome ribosome-pobj-to and-cc-comes matches-conj-comes it`s-poss-codon codon-dobj-matches with-prep-codon the-det-codons respective-amod-codons codons-pobj-with of-prep-codons the-det-mrna mrna-pobj-of ,-punct-matches dropping-advcl-matches one-nummod-molecule molecule-dobj-dropping of-prep-molecule amino-compound-acid acid-pobj-of as-mark-goes3 it-nsubj-goes3 goes3-advcl-dropping )-punct-comes the-det-acid amino-compound-acid acid-nsubj-collects collects-ROOT-collects ,-punct-collects forming-advcl-collects a-det-string long-amod-string string-dobj-forming of-prep-string amino-compound-acid4 acid4-pobj-of )-punct-collects the-det-ribosome ribosome-nsubj-takes takes-ROOT-takes in-prt-takes the-det-acid amino-compound-acid acid-dobj-takes and-cc-takes creates-conj-takes protein-dobj-creates"
0,it-nsubj-goes goes-ROOT-goes threw-ccomp-goes all-predet-parts the-det-parts cell-compound-parts parts-dobj-threw before-prep-threw being-auxpass-defined defined-pcomp-before
0,"the-det-photosynthesises mrna-nsubj-photosynthesises strand-nsubj-photosynthesises photosynthesises-ROOT-photosynthesises into-prep-photosynthesises a-det-condition suitbale-amod-condition living-compound-condition condition-pobj-into for-prep-condition the-det-body body-pobj-for .-punct-photosynthesises copies-ROOT-copies itself-dobj-copies to-aux-make make-xcomp-copies a-det-strand new-amod-strand strand-dobj-make .-punct-copies after-mark-copies it-nsubj-copies copies-advcl-removes itself-dobj-copies it-nsubj-removes removes-ROOT-removes bad-amod-parts parts-dobj-removes of-prep-parts the-det-strand strand-pobj-of and-cc-removes fills-conj-removes back-prt-fills up-advmod-fills witht-conj-fills the-det-copies copies-pobj-witht .-punct-removes then-advmod-repeats ,-punct-repeats repeats-ROOT-repeats the-det-process process-dobj-repeats .-punct-repeats"
0,trna-npadvmod-transcribe --punct-transcribe transcribe-amod-mrna mrna-nsubj-gather into-prep-mrna dnagrna--pobj-into gather-ROOT-gather informationrrna-compound-mrna-carries --punct-mrna-carries mrna-carries-compound-insruction insruction-dobj-gather to-prep-gather the-det-acid amino-compound-acid acid-pobj-to of-prep-acid a-det-protein protein-pobj-of
0,"first-advmod-told ,-punct-told the-det-mrna mrna-nsubjpass-told is-auxpass-told told-ROOT-told what-dobj-do to-aux-do do-xcomp-told and-cc-told gets-conj-told the-det-code code-dobj-gets from-prep-gets trna-pobj-from and-cc-gets attends-conj-gets to-prep-attends it-pobj-to .-punct-told second-advmod-brings ,-punct-brings the-det-trna trna-nsubj-brings brings-ROOT-brings anticodons-dobj-brings to-prep-brings the-det-third mrna.-compound-third third-pobj-to ,-punct-slowed the-det-process process-nsubjpass-slowed is-auxpass-slowed slowed-conj-brings down-prt-slowed and-cc-slowed anticodons-nsubjpass-brought are-auxpass-brought brought-conj-slowed to-prep-brought the-det-fourth mrna.-compound-fourth fourth-pobj-to ,-punct-occurs the-det-translation translation-nsubj-occurs occurs-conj-slowed and-cc-occurs amino-amod-acids acids-nsubjpass-linked are-auxpass-linked linked-conj-occurs together-advmod-linked to-aux-form form-xcomp-linked a-det-copy new-amod-copy copy-dobj-form .-punct-linked"
0,"the-det-mrna mrna-nsubj-sends sends-ROOT-sends a-det-message message-dobj-sends to-prep-sends the-det-nucleus nucleus-pobj-to ,-punct-tells the-det-nucleus nucleus-nsubj-tells tells-conj-sends the-det-cell cell-dobj-tells to-aux-make make-xcomp-tells proteins-dobj-make ,-punct-made proteins-nsubjpass-made are-auxpass-made made-advcl-repeats ,-punct-repeats it-nsubj-repeats repeats-conj-tells these-det-steps steps-dobj-repeats .-punct-repeats"
1,"protein-compound-synthesis synthesis-nsubj-has has-ROOT-has four-nummod-steps steps-dobj-has that-nsubj-involve involve-relcl-steps the-det-mrna mrna-nsubj-going going-ccomp-involve from-prep-going the-det-nucleus nucleus-pobj-from to-prep-going the-det-ribosome ribosome-pobj-to ,-punct-going and-cc-going then-advmod-going going-conj-going from-prep-going the-det-ribosome ribosome-pobj-from to-prep-going the-det-membrane cell-compound-membrane membrane-pobj-to and-cc-going then-advmod-to to-conj-going the-det-cytoplasm cytoplasm-pobj-to .-punct-has"
0,interfase-nsubj-is is-ROOT-is the-det-phase longest-amod-phase phase-attr-is in-prep-phase the-det-cycle cycle-pobj-in .-punct-is after-prep-is interfase-nsubj-is is-ROOT-is prophase-attr-is which-nsubj-is is-relcl-prophase the-det-stade first-amod-stade stade-attr-is of-prep-stade meiosis-pobj-of .-punct-is the-det-stage second-amod-stage stage-nsubj-is is-ROOT-is anaphase-attr-is which-dobj-splits the-det-nucleus nucleus-nsubj-splits splits-relcl-anaphase in-prep-splits two-pobj-in .-punct-is the-det-stage last-amod-stage stage-nsubj-is is-ROOT-is metaphase-attr-is .-punct-is then-advmod-have you-nsubj-have have-ROOT-have a-det-cell new-amod-cell cell-dobj-have .-punct-have
0,"first-advmod-goes ,-punct-goes mrna-nsubj-goes goes-ROOT-goes to-prep-goes the-det-lysosomes lysosomes-pobj-to .-punct-goes second-advmod-copies ,-punct-copies it-nsubj-copies copies-ccomp-gets into-prep-copies trna.third-pobj-into ,-punct-gets the-det-trna trna-nsubj-gets gets-ROOT-gets codons-dobj-gets .-punct-gets finally-advmod-proteins ,-punct-proteins the-det-proteins codons-amod-proteins form-compound-proteins proteins-ROOT-proteins .-punct-proteins"
0,1-ROOT-1 .-punct-1 it-nsubj-leaves leaves-ROOT-leaves the-det-nucleus nucleus-dobj-leaves then-advmod-go it-nsubj-go go-ccomp-leaves 's-case-go to-prep-'s where-advmod-needs it-nsubj-needs needs-pcomp-to to-aux-go2 go2-xcomp-needs .-punct-leaves then-advmod-seperates it-nsubj-seperates seperates-ROOT-seperates and-cc-seperates makes-conj-seperates brand-nmod-strands new-amod-strands strands-dobj-makes of-prep-strands what-nsubj-is is-pcomp-of needed3-acomp-is .-punct-seperates it-nsubj-mutiplies mutiplies-ROOT-mutiplies really-advmod-fast fast-advmod-mutiplies and-cc-mutiplies then-advmod-makes makes-conj-mutiplies more-dobj-makes and-cc-more more-conj-more of-prep-more what-nsubj-is is-pcomp-of needed4-acomp-is .-punct-mutiplies everthing-nsubjpass-made that-nsubjpass-needed is-auxpass-needed needed-relcl-everthing is-auxpass-made now-advmod-made made-ROOT-made
0,"mrna,is-ROOT-mrna,is the-det-messanger messanger-dobj-mrna,is which-nsubj-leaves leaves-relcl-messanger the-det-nucleus nucleus-dobj-leaves .-punct-mrna,is trna-npadvmod-transfer ,-punct-transfer transfer-ROOT-transfer information-dobj-transfer to-prep-transfer the-det-ribosome ribosome-pobj-to .-punct-transfer"
0,telephase.metaphase.anaphase-ROOT-telephase.metaphase.anaphase .-punct-telephase.metaphase.anaphase
0,the-det-mrna mrna-nsubj-delivers delivers-ROOT-delivers a-det-code code-dobj-delivers to-prep-delivers the-det-mitochondria mitochondria-pobj-to .-punct-delivers then-advmod-translates it-nsubj-translates translates-ROOT-translates the-det-code code-dobj-translates into-prep-translates amino-compound-acids acids-pobj-into .-punct-translates the-det-acids amino-amod-acids acids-nsubjpass-put are-auxpass-put then-advmod-put put-ROOT-put into-prep-put specific-amod-codes codes-pobj-into based-prep-put on-prep-based what-dobj-said the-det-mrna mrna-nsubj-said said-pcomp-on .-punct-put
0,first-advmod-takes the-det-reticulum endoplasmic-amod-reticulum reticulum-nsubj-takes takes-ROOT-takes the-det-protein protein-dobj-takes and-cc-takes breaks-conj-takes it-dobj-breaks down-prt-breaks .-punct-takes  -ROOT-  secondly-advmod-compress the-det-ribezomes ribezomes-nsubj-compress compress-ROOT-compress what-nsubjpass-left is-auxpass-left left-ccomp-compress down-prt-left .-punct-compress  -ROOT-  then-advmod-takes the-det-apparatus golgi-compound-apparatus apparatus-nsubj-takes takes-ROOT-takes it-dobj-takes to-prep-takes the-det-membrane cell-compound-membrane membrane-pobj-to .-punct-takes   -advmod-takes the-det-membrane cell-compound-membrane membrane-nsubj-takes then-advmod-takes takes-ROOT-takes it-dobj-takes out-prep-takes of-prep-out the-det-cell cell-pobj-of .-punct-takes
0,"gathering-advmod-needs ,-punct-needs protein-nsubj-needs needs-ROOT-needs to-aux-breath breath-xcomp-needs ,-punct-needs so-advmod-needs it-nsubj-needs needs-conj-needs more-amod-room room-dobj-needs"
1,"mrna-nsubj-leaves leaves-ROOT-leaves the-det-nucleus nucleus-dobj-leaves ,-punct-copied then-advmod-copied it-nsubjpass-copied is-auxpass-copied copied-advcl-leaves into-prep-copied rrna-pobj-into and-cc-rrna trna-conj-rrna carrying-advcl-copied an-det-attatch amino-compound-acid acid-compound-attatch attatch-dobj-carrying to-prep-carrying the-det-acid nucleic-amod-acid acid-pobj-to in-prep-acid segments-pobj-in of-prep-segments three-pobj-of .-punct-leaves the-det-trna trna-nsubj-attatches attatches-ROOT-attatches to-prep-attatches certain-amod-sequences nucliotide-amod-sequences sequences-pobj-to that-nsubj-code code-nsubj-attatched for-prep-code the-det-protein protein-pobj-for attatched-relcl-sequences to-prep-attatched it-pobj-to and-cc-attatched then-advmod-form body-compound-form form-conj-attatched between-prep-form the-det-acids amino-amod-acids acids-pobj-between as-mark-come more-amod-trna trna-nsubj-come come-advcl-form and-cc-come once-mark-let the-det-forms bond-compound-forms forms-nsubjpass-let between-prep-forms the-det-acid amino-compound-acid acid-pobj-between the-det-trna trna-nsubjpass-let is-auxpass-let let-conj-come go-ccomp-let .-punct-attatches by-prep-created the-det-end end-pobj-by of-prep-end the-det-chain rna-compound-chain chain-pobj-of a-det-string long-amod-string string-nsubjpass-created of-prep-string amino-compound-acids acids-pobj-of has-aux-created been-auxpass-created created-ROOT-created"
0,protein-amod-synthesis synthesis-ROOT-synthesis cellular-amod-resperation resperation-nmod-synthesis
0,mrna-nsubj-leaves leaves-ROOT-leaves the-det-nucleus.it nucleus.it-dobj-leaves makes-conj-leaves a-det-copy copy-dobj-makes of-prep-copy itself.the-det-copy copy-pobj-of then-advmod-makes makes-conj-leaves protein.and-compound-transcription transcription-nsubj-occurs occurs-ccomp-makes .-punct-leaves
0,transcriptionreplicationtraslationtransfussion-ROOT-transcriptionreplicationtraslationtransfussion
0,"1-meta-creating )-punct-1 creating-ROOT-creating energy2)going-nmod-metaphase throught-compound-metaphase metaphase-dobj-creating ,-punct-metaphase prophase-conj-metaphase ,-punct-metaphase interphase-intj-metaphase"
0,it-nsubj-changes changes-ROOT-changes with-prep-changes partners-pobj-with to-aux-keep keep-advcl-changes the-det-chin chin-dobj-keep going-xcomp-keep .-punct-changes it-nsubj-attaches attaches-ROOT-attaches with-prep-attaches a-det-dna dna-pobj-with .-punct-attaches it-nsubj-sends sends-ROOT-sends messages-dobj-sends to-prep-sends the-det-stuff other-amod-stuff other-amod-stuff stuff-pobj-to .-punct-sends
0,anaphase-compound-prophase prophase-compound-metaphase interphase-compound-metaphase metaphase-ROOT-metaphase
0,"1-meta-leaves .-punct-1 mrna-nsubj-leaves leaves-ccomp-tells the-det-cell cell-dobj-leaves ,-punct-tells it-nsubj-tells tells-ROOT-tells the-det-enzyems enzyems-dobj-tells which-det-strand dna-compound-strand strand-relcl-enzyems to-aux-work work-xcomp-tells on.2-advmod-work .-punct-tells an-det-enzyme enzyme-nsubj-attaches attaches-ROOT-attaches to-prep-attaches the-det-strand3 dna-compound-strand3 strand3-pobj-to .-punct-attaches the-det-enzyme enzyme-nsubj-strats strats-ROOT-strats to-aux-decode decode-xcomp-strats the-det-strand dna-compound-strand strand-dobj-decode into-prep-decode complumentary-compound-rna4 rna4-pobj-into .-punct-strats the-det-enzyme enzyme-nsubj-detaches detaches-ROOT-detaches and-cc-detaches moves-conj-detaches on-advmod-moves .-punct-detaches"
1,"after-mark-leaves the-det-mrna mrna-nsubj-leaves leaves-advcl-taken the-det-nucleus nucleus-dobj-leaves ,-punct-taken it-nsubjpass-taken is-auxpass-taken taken-ROOT-taken to-prep-taken the-det-ribosome ribosome-pobj-to by-agent-taken trna-pobj-by and-cc-taken it-nsubjpass-made is-auxpass-made made-conj-taken into-prep-made proteins-pobj-into"
1,1-ROOT-1 .-punct-1 the-det-mrna mrna-nsubj-tells tells-ROOT-tells the-det-trna trna-dobj-tells to-aux-get get-xcomp-tells ready-acomp-get at-prep-get the-det-ribosome2 ribosome2-pobj-at .-punct-tells the-det-trna trna-nsubj-goes goes-ROOT-goes and-cc-goes attaches-conj-goes the-det-together3 pairs-compound-together3 together3-dobj-attaches .-punct-goes they-nsubj-keep keep-ROOT-keep attaching-xcomp-keep until-mark-hits it-nsubj-hits hits-advcl-attaching stop-xcomp-hits codon4-dobj-stop .-punct-keep the-det-protein protein-nsubjpass-released is-auxpass-released released-ROOT-released
0,step-advcl-finds one-dobj-step :-punct-finds it-nsubj-finds finds-ROOT-finds a-det-ribosome ribosome-dobj-finds and-cc-finds is-auxpass-copied copied-conj-finds .-punct-finds step-ROOT-step two-nummod-step :-punct-leaves it-nsubj-leaves leaves-ROOT-leaves the-det-ribosome ribosome-dobj-leaves and-cc-leaves goes-conj-leaves to-prep-goes the-det-nucleous nucleous-pobj-to .-punct-leaves step-ROOT-step three-nummod-step :-punct-step i-nsubj-know do-aux-know nt-neg-know know-ROOT-know
1,the-det-mrna mrna-nsubj-goes goes-ROOT-goes to-prep-goes the-det-ribosome ribosome-pobj-to and-cc-goes gives-conj-goes the-det-codes potien-compound-codes codes-dobj-gives to-dative-gives the-det-rna ribosomal-amod-rna rna-pobj-to
0,1-ROOT-1 .-punct-1 the-det-mrna mrna-nsubj-leaves leaves-ROOT-leaves the-det-nucleus.2 nucleus.2-dobj-leaves .-punct-leaves the-det-material genetic-amod-material material-nsubjpass-transcribed is-auxpass-transcribed transcribed-ROOT-transcribed into-prep-transcribed rna-compound-form3 form3-pobj-into .-punct-transcribed the-det-material genetic-amod-material material-nsubjpass-taken is-auxpass-taken taken-ROOT-taken to-prep-taken the-det-ribosomes.4 ribosomes.4-pobj-to .-punct-taken protein-compound-synthesis synthesis-nsubj-occurs occurs-ROOT-occurs .-punct-occurs
0,it-nsubj-leaves leaves-ROOT-leaves goes-conj-leaves to-aux-deliver deliver-xcomp-goes information-dobj-deliver .-punct-leaves goes-ROOT-goes to-prep-goes the-det-rrna rrna-pobj-to and-cc-goes it-nsubj-reades reades-conj-goes the-det-information information-dobj-reades .-punct-reades then-advmod-makes it-nsubj-makes makes-ROOT-makes a-det-copy.and copy.and-dobj-makes that-nsubj-goes copy-nsubj-goes goes-relcl-copy.and out-prt-goes and-cc-goes finds-conj-goes matches-dobj-finds to-aux-go go-relcl-matches with-prep-go .-punct-makes
0,mrna-nsubj-leaves leaves-ROOT-leaves the-det-nucleus.trna nucleus.trna-nmod-starts.grna starts.grna-dep-starts starts.rrna-nsubj-starts starts-oprd-leaves .-punct-starts ?-punct-leaves
0,the-det-mrna mrna-nsubj-leaves leaves-ROOT-leaves the-det-membrane nuclear-amod-membrane membrane-dobj-leaves .-punct-leaves dna-compound-copies copies-ROOT-copies itself-appos-copies .-punct-copies the-det-dna old-amod-dna dna-nsubj-dies dies-ROOT-dies
1,"the-det-mrna mrna-nsubj-leaves that-nsubjpass-copied was-auxpass-copied copied-relcl-mrna from-prep-copied the-det-dna dna-pobj-from leaves-ROOT-leaves the-det-nucleus nucleus-dobj-leaves .-punct-leaves it-nsubj-goes goes-ROOT-goes to-prep-goes the-det-ribosome ribosome-pobj-to ,-punct-ribosome where-advmod-is it-nsubj-is is-relcl-ribosome transcripted-acomp-is .-punct-goes each-det-codes codon-nsubj-codes codes-ROOT-codes for-prep-codes an-det-acid amino-compound-acid acid-pobj-for .-punct-codes the-det-proteins proteins-nsubjpass-linked are-auxpass-linked linked-ROOT-linked together-advmod-linked as-mark-translated they-nsubjpass-translated are-auxpass-translated translated-advcl-linked .-punct-linked"
0,"cell-nmod-system ,-punct-cell tissue-conj-cell ,-punct-tissue organ-conj-tissue ,-punct-organ organ-compound-system system-ROOT-system .-punct-system"
0,"the-det-mrna mrna-nsubj-leaves leaves-ROOT-leaves the-det-nucleus nucleus-dobj-leaves transporting-acl-nucleus information-dobj-transporting .-punct-leaves then-advmod-travels the-det-mrna mrna-nsubj-travels travels-ROOT-travels to-prep-travels the-det-membrane cells-compound-membrane membrane-pobj-to .-punct-travels then-advmod-drops the-det-drops mrna-nsubj-drops drops-nsubj-goes off-prep-drops the-det-information information-pobj-off ,-punct-goes then-advmod-goes goes-ROOT-goes back-advmod-goes to-prep-back the-det-nucleus nucleus-pobj-to .-punct-goes"
0,the-det-mrna mrna-nsubjpass-copied is-auxpass-copied copied-ROOT-copied .-punct-copied
0,"it-nsubj-has has-ccomp-leaves to-aux-makes makes-xcomp-has it-dobj-makes past-prep-makes all-predet-intruders the-det-intruders intruders-pobj-past ,-punct-leaves it-nsubj-leaves leaves-ROOT-leaves the-det-area area-dobj-leaves it-nsubj-began began-relcl-area ,-punct-mutates it-nsubj-mutates mutates-parataxis-forms ,-punct-forms it-nsubj-forms forms-conj-leaves new-amod-cells cells-dobj-forms .-punct-forms"
0,it-nsubj-needs needs-ROOT-needs to-aux-abtain abtain-xcomp-needs more-amod-proein proein-dobj-abtain
1,"the-det-mrna mrna-nsubj-leaves leaves-ROOT-leaves the-det-nucleus nucleus-dobj-leaves with-prep-leaves the-det-dna transcribed-amod-dna dna-pobj-with ,-punct-dna which-nsubj-forms forms-relcl-dna rna-dobj-forms ,-punct-leaves and-cc-leaves takes-conj-leaves it-dobj-takes to-prep-takes the-det-rrna rrna-pobj-to which-nsubj-is is-relcl-rrna the-det-rna. ribosomal-compound-rna. rna.-attr-is the-det-rrna rrna-nsubj-takes takes-ROOT-takes it-dobj-takes to-aux-trna trna-xcomp-takes to-aux-read be-auxpass-read read-xcomp-trna .-punct-takes trna-nsubj-stands stands-ROOT-stands for-prep-stands transfer-pobj-for rna.-compound-trna trna-nsubj-reads reads-advcl-stands and-cc-reads changes-conj-reads the-det-codons codons-dobj-changes to-prep-changes amino-amod-acids acids-pobj-to .-punct-stands"
0,it-nsubj-goes goes-ROOT-goes to-prep-goes same-amod-place place-pobj-to
0,making-ROOT-making protein-dobj-making
1,"protein-amod-synthesis synthesis-nsubj-consists consists-ROOT-consists of-prep-consists the-det-building building-pobj-of of-prep-building amino-compound-acids acids-pobj-of .-punct-consists then-advmod-forming they-nsubj-forming link-aux-forming together-advmod-forming forming-ROOT-forming a-det-chain chain-dobj-forming .-punct-forming next-mark-attach the-det-chains chains-nsubj-attach attach-ROOT-attach together-advmod-attach .-punct-attach lastly-advmod-turn ,-punct-turn they-nsubj-turn turn-ROOT-turn into-prep-turn the-det-rna. new-amod-rna. rna.-pobj-into"
0,"well-intj-have you-nsubj-have have-ROOT-have the-det-codon stop-compound-codon codon-dobj-have ,-punct-have then-advmod-have ...-punct-have i-nsubj-know do-aux-know nt-neg-know know-ROOT-know the-det-rest rest-dobj-know"
0,it-nsubj-sends sends-ROOT-sends a-det-cell message-compound-cell t-compound-cell othe-compound-cell cell-dobj-sends that-nsubj-needs needs-relcl-cell the-det-protein protein-dobj-needs then-advmod-sends it-nsubj-sends sends-conj-sends it-dobj-sends back-advmod-sends to-prep-back the-det-brain brain-pobj-to to-aux-get get-advcl-sends that-det-protein protein-dobj-get
0,the-det-mrna mrna-nsubjpass-carried is-auxpass-carried carried-ROOT-carried off-prt-carried into-prep-carried different-amod-parts parts-pobj-into in-prep-parts the-det-synthesis whole-amod-synthesis protein-compound-synthesis synthesis-pobj-in by-prep-carried going-pcomp-by down-advmod-going to-prep-down where-advmod-carried it-nsubjpass-carried will-aux-carried get-auxpass-carried carried-pcomp-to off-prt-carried to-aux-make make-advcl-carried protein-dobj-make .-punct-carried  -ROOT-  then-advmod-is is-advmod-taken will-aux-taken be-auxpass-taken taken-ROOT-taken to-prep-taken where-advmod-get it-nsubj-get can-aux-get get-pcomp-to energy-dobj-get .-punct-taken  -ROOT-  after-mark-goes that-mark-goes it-nsubj-goes goes-ROOT-goes through-prep-goes a-det-phase different-amod-phase phase-pobj-through and-cc-phase and-cc-phase the-det-end end-conj-phase it-nsubjpass-carried is-auxpass-carried carried-relcl-phase to-prep-carried the-det-end end-pobj-to that-nsubj-makes makes-relcl-end protein-dobj-makes .-punct-goes
0,"there-expl-are are-ROOT-are four-nummod-steps major-amod-steps steps-attr-are involved-acl-steps in-prep-involved protein-compound-synthesis synthesis-pobj-in .-punct-are one-nsubj-is of-prep-one them-pobj-of is-ROOT-is replication-attr-is .-punct-is the-det-cells mrna-compound-cells cells-nsubj-replicate must-aux-replicate replicate-ROOT-replicate in-prep-replicate order-pobj-in to-aux-leave leave-acl-order the-det-cell cell-dobj-leave .-punct-replicate next-advmod-copy they-nsubj-copy must-aux-copy copy-ROOT-copy other-amod-cells cells-dobj-copy .-punct-copy after-prep-duplicate that-pobj-after ,-punct-duplicate they-nsubj-duplicate must-aux-duplicate duplicate-ROOT-duplicate .-punct-duplicate lastly-advmod-zip they-nsubj-zip will-aux-zip zip-ROOT-zip back-advmod-together together-advmod-zip to-aux-make make-xcomp-zip more-amod-copies copies-dobj-make .-punct-zip"
1,"the-det-mrna mrna-nsubj-leaves leaves-ROOT-leaves the-det-cell cell-dobj-leaves and-cc-leaves goes-conj-leaves into-prep-goes the-det-cytoplasm cytoplasm-pobj-into of-prep-cytoplasm the-det-cell cell-pobj-of .-punct-leaves then-ROOT-then ,-punct-pairs the-det-codon codon-nsubj-pairs and-cc-codon anti-amod-codon --punct-codon codon-conj-codon pairs-meta-then up-prt-pairs .-punct-pairs then-advmod-released the-det-codon anti-amod-codon --punct-codon codon-nsubjpass-released is-auxpass-released released-ROOT-released .-punct-released then-advmod-onece onece-ROOT-onece it-nsubj-reaches reaches-conj-onece a-det-stop stop-dobj-reaches codon-intj-is there-expl-is is-ROOT-is a-det-chain chain-attr-is of-prep-chain amino-compound-acids acids-pobj-of .-punct-is"
0,rna-ROOT-rna
1,the-det-step first-amod-step step-nsubj-leaving is-aux-leaving leaving-ROOT-leaving the-det-nucleus nucleus-dobj-leaving .-punct-leaving this-det-step step-nsubj-is is-ROOT-is important-acomp-is because-mark-goes the-det-mrna mrna-nsubj-goes goes-advcl-is through-prep-goes the-det-pores nuclear-amod-pores pores-pobj-through to-aux-go go-advcl-goes to-prep-go the-det-cell cell-pobj-to .-punct-is the-det-step next-amod-step step-nsubj-sending is-aux-sending sending-ROOT-sending the-det-message message-dobj-sending through-prep-sending the-det-cell cell-pobj-through .-punct-sending
0,"the-det-mrna mrna-nsubjpass-read is-auxpass-read read-ROOT-read by-agent-read the-det-trna. trna.-pobj-by  -npadvmod-read then-advmod-put the-det-trna trna-nsubj-put must-aux-put put-ROOT-put on-prt-put a-det-cap cap-pobj-on and-cc-cap a-det-tail tail-conj-cap ,-punct-put so-mark-move that-mark-move it-nsubj-move can-aux-move move-advcl-put and-cc-move it-nsubj-keep can-aux-keep keep-conj-move the-det-sequence sequence-dobj-keep in-advmod-there there-advmod-keep .-punct-put  -ROOT-  then-advmod-read it-nsubjpass-read is-auxpass-read read-ROOT-read by-agent-read the-det-protein protein-pobj-by creating-acl-protein the-det-acid amino-compound-acid acid-dobj-creating .-punct-read"
0,mrna-nsubj-instructs instructs-ROOT-instructs the-det-protien protien-dobj-instructs
