label,text
0,"when-advmod-leaves mrna-nsubj-leaves leaves-advcl-are the-det-nucleus nucleus-dobj-leaves ,-punct-are there-expl-are are-ROOT-are four-nummod-steps major-amod-steps steps-attr-are involved-amod-steps for-prep-involved protein-compound-synthesis synthesis-pobj-for .-punct-are they-nsubj-are are-ROOT-are prophase-attr-are ,-punct-prophase metaphase-conj-prophase ,-punct-metaphase anaphase-conj-metaphase ,-punct-anaphase and-cc-anaphase telophase-conj-anaphase .-punct-are they-nsubj-help help-ROOT-help with-prep-help meiosis-pobj-with .-punct-help prophase-nsubj-is is-ROOT-is where-advmod-split the-det-dissapear nuclear-amod-membrane membrane-compound-dissapear dissapear-nsubj-split and-cc-dissapear the-det-chromosomes chromosomes-conj-dissapear split-advcl-is .-punct-is metaphase-nsubj-is is-ROOT-is where-advmod-line the-det-chromosomes chromosomes-nsubj-line line-ccomp-is up-prt-line .-punct-is anaphase-nsubj-is is-ROOT-is where-advmod-go the-det-chromosomes chromosomes-nsubj-go go-advcl-is off-prt-go into-prep-go groups-pobj-into ,-punct-go and-cc-go telophase-nsubj-is is-ROOT-is when-advmod-gain they-nsubj-gain gain-advcl-is the-det-membrane nuclear-amod-membrane membrane-dobj-gain back-advmod-gain .-punct-is"
1,"when-advmod-leaves the-det-mrna mrna-nsubj-leaves leaves-advcl-travels the-det-nucleus nucleus-dobj-leaves ,-punct-travels it-nsubj-travels travels-ROOT-travels through-prep-travels the-det-cell cell-pobj-through .-punct-travels  -ROOT-  it-nsubj-moves moves-ROOT-moves to-prep-moves a-det-ribosome ribosome-pobj-to .-punct-moves  -ROOT-  the-det-ribosome ribosome-nsubj-makes makes-ROOT-makes trna.-nsubj-   -ccomp-makes then-advmod-synthesized ,-punct-synthesized protien-nsubjpass-synthesized is-auxpass-synthesized synthesized-ccomp-makes .-punct-makes"
0,transcriptionreplicationtranslation-ROOT-transcriptionreplicationtranslation
0,"the-det-mrna mrna-nsubj-leaves leaves-ROOT-leaves the-det-nucleus nucleus-dobj-leaves ,-punct-leaves and-cc-leaves is-auxpass-synthesized then-advmod-synthesized synthesized-conj-leaves into-prep-synthesized trna-pobj-into ,-punct-trna which-nsubj-carries carries-relcl-trna the-det-code code-dobj-carries for-prep-carries making-pcomp-for proteins-dobj-making .-punct-leaves the-det-trna trna-nsubjpass-transcribed is-auxpass-transcribed transcribed-ROOT-transcribed into-prep-transcribed rrna-pobj-into which-nsubjpass-used can-aux-used then-advmod-used be-auxpass-used used-relcl-rrna by-agent-used the-det-body body-pobj-by to-aux-synthesize synthesize-xcomp-used proteins-dobj-synthesize .-punct-transcribed"
0,"making-ROOT-making the-det-protein protein-dobj-making ,-punct-making getting-dep-making things-dobj-getting to-aux-assemble assemble-advcl-getting the-det-protein protein-dobj-assemble ,-punct-getting getting-conj-getting information-dobj-getting on-prep-information how-advmod-make to-aux-make make-pcomp-on protein-dobj-make ,-punct-make synthesizing-conj-getting protein-dobj-synthesizing .-punct-making"
1,"after-mark-leaves mrna-nsubj-leaves leaves-advcl-goes the-det-nucleus nucleus-dobj-leaves it-nsubj-goes goes-ccomp-released through-prep-goes the-det-reticulum endoplasmic-amod-reticulum reticulum-pobj-through ,-punct-reticulum which-nsubj-filters filters-relcl-reticulum the-det-protiens bad-amod-protiens protiens-dobj-filters out-prt-filters ,-punct-released then-advmod-released it-nsubjpass-released is-auxpass-released released-ROOT-released into-prep-released the-det-cytoplasma cytoplasma-pobj-into of-prep-cytoplasma the-det-cell cell-pobj-of ,-punct-leaves then-advmod-leaves it-nsubj-leaves leaves-advcl-released the-det-cell cell-dobj-leaves and-cc-leaves transports-conj-leaves diferent-amod-material material-dobj-transports to-prep-transports a-det-cell different-amod-cell cell-pobj-to .-punct-leaves"
0,trnagrnamrnarrna-ROOT-trnagrnamrnarrna
0,"first-advmod-goes ,-punct-goes it-nsubj-goes goes-ROOT-goes to-prep-goes the-det-cells cells-pobj-to and-cc-goes then-advmod-take the-det-cells cells-nsubj-take take-conj-goes it-dobj-take and-cc-take follow-conj-take the-det-directions directions-dobj-follow .-punct-take then-advmod-copy they-nsubj-copy copy-ROOT-copy it-dobj-copy and-cc-copy make-conj-copy more-amod-dna. dna.-dobj-make"
0,1-meta-mitocandiria .-punct-1 mitocandiria-ROOT-mitocandiria
0,mrna-compound-leaves leaves-ROOT-leaves .-punct-leaves     -punct-mix gives-advcl-mix the-det-code code-dobj-gives to-prep-gives trna.-pobj-to     -nummod-trna trna-nsubj-gives gives-conj-gives the-det-acid amino-amod-acid acid-dobj-gives to-dative-gives the-det-protien protien-pobj-to .-punct-gives     -dep-mix they-nsubj-mix mix-ROOT-mix .-punct-mix
0,translation-ROOT-translation
0,"mrna,trna,and-compound-rrnamrna rrnamrna-nsubj-sends sends-ROOT-sends messages-dobj-sends to-prep-sends the-det-nuclues nuclues-pobj-to .-punct-sends trna-nsubj-transports transports-ROOT-transports proteins-dobj-transports through-prep-transports the-det-cell cell-pobj-through .-punct-transports and-cc-makes rrna-nsubj-makes makes-ROOT-makes ribosomes-dobj-makes for-prep-ribosomes the-det-cell cell-pobj-for .-punct-makes"
0,the-det-data trna-nsubj-transfers transfers-compound-data data-ROOT-data .-punct-data
0,1-meta-copies .-punct-1 mrna-compound-copies copies-ROOT-copies into-prep-copies trna2-pobj-into .-punct-copies trna-nsubj-transfers transfers-ROOT-transfers to-prep-transfers a-det-helix3 double-amod-helix3 helix3-pobj-to .-punct-transfers the-det-copies trna-compound-copies copies-ROOT-copies to-prep-copies another-det-dna4 dna4-pobj-to .-punct-copies there-expl-are are-ROOT-are two-nummod-copies copies-attr-are of-prep-copies dna-pobj-of
3,"when-advmod-leaves the-det-mrna mrna-nsubj-leaves leaves-advcl-1 the-det-nucleus nucleus-dobj-leaves ,-punct-1 1-ROOT-1 .-punct-1 it-nsubj-goes goes-ROOT-goes to-prep-goes the-det-reticulum endoplasmic-amod-reticulum reticulum-pobj-to where-advmod-begins protein-compound-synthesis synthesis-nsubj-begins begins-relcl-reticulum .-punct-goes  -nmod-2 2-ROOT-2 .-punct-goes ribosomes-nsubj-move then-advmod-move move-ROOT-move in-advmod-move to-aux-begin begin-advcl-move the-det-process process-dobj-begin of-prep-process synthesis-pobj-of where-advmod-moved anticodons-nsubjpass-moved are-auxpass-moved moved-relcl-process on-prt-moved to-prep-moved the-det-codons correct-amod-codons codons-pobj-to transferring-advcl-moved the-det-code correct-amod-code amino-compound-code acid-compound-code code-dobj-transferring that-nsubj-is is-relcl-code to-aux-made be-auxpass-made made-xcomp-is .-punct-move 3-meta-made .-punct-3 the-det-acid amino-compound-acid acid-nsubjpass-made is-auxpass-made made-ROOT-made and-cc-made attached-conj-made to-prep-attached all-det-acids other-amod-acids amino-amod-acids acids-pobj-to beside-prep-acids it-pobj-beside with-prep-acids peptide-compound-bonds bonds-pobj-with .-punct-made 4-ROOT-4 .-punct-4 a-det-codon stop-compound-codon codon-nsubj-tells tells-ROOT-tells the-det-acids amino-compound-acids acids-dobj-tells to-aux-stop stop-xcomp-tells and-cc-stop the-det-acid previous-amod-acid amino-compound-acid acid-nsubj-becomes becomes-conj-tells the-det-last last-attr-becomes in-prep-last the-det-chain chain-pobj-in ,-punct-becomes making-advcl-becomes a-det-protein complete-amod-protein protein-dobj-making .-punct-becomes"
0,it-nsubj-copies copies-ROOT-copies itself-dobj-copies then-advmod-translates it-nsubj-translates translates-conj-copies then-advmod-transcripts it-nsubj-transcripts transcripts-ccomp-translates
0,"prtein-amod-synthesis synthesis-nsubj-takes takes-ROOT-takes place-dobj-takes after-prep-takes leaving-pcomp-after the-det-nucleus nucleus-dobj-leaving .-punct-takes the-det-steps four-nummod-steps major-amod-steps steps-nsubj-are are-ROOT-are movement-attr-are ,-punct-movement reproduction-conj-movement ,-punct-reproduction growth-conj-reproduction and-cc-growth  -conj-growth new-amod-rna rna-dobj-  .-punct-are"
0,mrna-nsubjpass-involved as-prep-mrna a-det-polymer polymer-pobj-as is-auxpass-involved involved-ROOT-involved in-prep-involved protein-compound-synthesis synthesis-pobj-in .-punct-involved they-nsubj-making are-aux-making making-ROOT-making the-det-proteins proteins-dobj-making snythesis-conj-making with-prep-snythesis each-det-other other-pobj-with .-punct-making step-dep-is 1-nummod-step :-punct-step to-aux-arrive arrive-acl-step where-advmod-brake the-det-proteins proteins-nsubj-brake are2-dep-brake :-punct-brake brake-ccomp-arrive the-det-proteins proteins-dobj-brake up3-nmod-proteins :-punct-proteins conncet-amod-proteins proteins-acl-proteins again-advmod-brake with-prep-brake rna-pobj-with 4-nummod-rna :-punct-step the-det-process process-nsubj-is is-ROOT-is complete-acomp-is
1,"transcription-nsubj-calls ,-punct-calls ribosome-nsubj-calls calls-ROOT-calls for-prep-calls amino-compound-acids acids-pobj-for ,-punct-acids translation-conj-calls .-punct-calls proteins-nsubjpass-made are-auxpass-made made-ROOT-made by-agent-made the-det-acids amino-compound-acids acids-pobj-by binding-acl-acids together-advmod-binding .-punct-made"
0,"transportation-dep-helps :-punct-transportation dna-nsubj-becoming becoming-dep-helps mrna.transcription-attr-becoming :-punct-mrna.transcription mrna-nsubj-becoming becoming-acl-mrna.transcription protiens.peptide-amod-bonds bonds-attr-becoming :-punct-becoming holding-dep-becoming the-det-protiens protiens-dobj-holding together.deoxirybose-dep-holding :-punct-helps the-det-sugar sugar-advcl-helps in-prep-sugar the-det-protiens protiens-pobj-in ,-punct-helps it-nsubj-helps helps-ROOT-helps make-xcomp-helps the-det-protiens protiens-dobj-make .-punct-helps"
0,the-det-step first-amod-step step-nsubj-is in-prep-step protein-compound-synthesis synthesis-pobj-in is-ROOT-is after-prep-is leaving-pcomp-after the-det-nucleus nucleus-dobj-leaving the-det-mrna mrna-nsubj-look will-aux-look look-ROOT-look for-prep-look the-det-protein protein-pobj-for .-punct-look the-det-step second-amod-step step-nsubj-is is-ROOT-is the-det-mrna mrna-attr-is will-aux-copy copy-conj-is the-det-protein protein-dobj-copy .-punct-is  -dep-is the-det-step therd-amod-step step-nsubj-is is-ccomp-is that-mark-make the-det-mrna mrna-nsubj-make will-aux-make make-ccomp-is new-amod-protein protein-dobj-make and-cc-protein the-det-step final-amod-step step-nsubj-is is-ROOT-is the-det-mrna mrna-attr-is will-aux-head head-conj-is back-advmod-head to-prep-back the-det-nucleus nucleus-pobj-to .-punct-is
0,first-advmod-turns the-det-dna dna-nsubj-turns turns-advcl-turned into-prep-turns mrna-pobj-into then-advmod-turned the-det-mrna mrna-nsubjpass-turned is-auxpass-turned turned-ccomp-leaves into-prep-turned rna-pobj-into through-prep-turned the-det-process process-pobj-through of-prep-process transcription.then-pobj-of the-det-rna rna-pobj-of leaves-ROOT-leaves the-det-nucleus nucleus-dobj-leaves and-cc-leaves goes-conj-leaves through-prep-goes a-det-process process-pobj-through of-prep-process translation.then-amod-signals signals-pobj-of for-prep-goes the-det-trna.then trna.then-pobj-for the-det-trna trna-nsubj-makes makes-conj-leaves the-det-proteins proteins-dobj-makes .-punct-makes
1,"during-prep-leaves protein-compound-synthesis synthesis-pobj-during ,-punct-leaves mrna-nsubj-leaves leaves-ROOT-leaves the-det-nucleus nucleus-dobj-leaves .-punct-leaves  -ROOT-  the-det-trna trna-nsubj-takes takes-ROOT-takes the-det-codon anti-amod-codon --punct-codon codon-dobj-takes and-cc-takes matches-conj-takes it-dobj-matches with-prep-matches the-det-codon corresponding-amod-codon codon-pobj-with on-prep-codon the-det-molecule mrna-compound-molecule molecule-pobj-on .-punct-takes  -ROOT-  it-nsubj-attaches attaches-ROOT-attaches on-prep-attaches the-det-ribosome ribosome-pobj-on .-punct-attaches    -ROOT-    this-nsubj-makes then-advmod-makes makes-ROOT-makes the-det-acid amino-compound-acid acid-nmod-chain polypeptide-compound-chain chain-dobj-makes .-punct-makes  -ROOT-  once-mark-are those-det-steps steps-nsubj-are are-advcl-have complete-acomp-are ,-punct-have you-nsubj-have have-ROOT-have the-det-protein protein-dobj-have that-nsubjpass-coded the-det-mrna mrna-nsubj-was was-auxpass-coded coded-relcl-protein for-prep-coded .-punct-have"
0,the-det-mrna mrna-nsubj-goes goes-ROOT-goes to-prep-goes out-prep-to of-prep-out the-det-cell cell-pobj-of and-cc-goes travels-conj-goes to-prep-travels the-det-cells others-compound-cells cells-pobj-to and-cc-goes then-advmod-comes comes-conj-goes back-advmod-comes into-prep-back the-det-cell cell-pobj-into to-aux-repeat repeat-advcl-comes the-det-process process-dobj-repeat .-punct-goes
1,the-det-dna dna-nsubjpass-copied is-auxpass-copied copied-ROOT-copied by-agent-copied the-det-mrna. mrna.-pobj-by then-advmod-translated is-auxpass-translated translated-ROOT-translated by-agent-translated the-det-trna. trna.-pobj-by then-advmod-translated for-prep-translated every-det-strands 3-nummod-strands strands-pobj-for of-prep-strands codons-pobj-of are-auxpass-translated translated-conj-translated an-det-chain amino-compound-acid acid-compound-chain chain-nsubjpass-formed is-auxpass-formed formed-conj-translated .-punct-formed then-advmod-formed when-advmod-happens the-det-code code-nsubj-happens for-prep-code stop-pobj-for happens-advcl-formed a-det-protein protein-nsubjpass-formed is-auxpass-formed formed-ROOT-formed .-punct-formed
3,"after-mark-leaves the-det-mrna the-det-mrna mrna-nsubj-leaves leaves-advcl-throught the-det-cells cells-dobj-leaves nuclaer-compound-envolope envolope-nsubj-throught throught-ROOT-throught the-det-pores pores-dobj-throught in-prep-pores the-det-envolope envolope-pobj-in the-det-rna m-compound-rna rna-nsubj-seeks seeks-conj-throught out-prt-seeks a-det-ribosome ribosome-dobj-seeks (-punct-ribosome an-det-organelle organelle-appos-ribosome that-dobj-based synthisize-compound-protien protien-nsubj-based based-relcl-organelle on-prep-based the-det-codons codons-pobj-on it-nsubj-get get-relcl-codons for-prep-get the-det-rna messenge-compound-rna rna-pobj-for )-punct-ribosome  -conj-seeks to-aux-synthisize synthisize-xcomp-  the-det-proteins proteins-dobj-synthisize it-nsubj-has has-relcl-proteins codons-dobj-has for-prep-has .-punct-seeks after-mark-finds the-det-mrna mrna-nsubj-finds finds-ROOT-finds a-det-ribosome ribosome-dobj-finds to-aux-synthisize synthisize-xcomp-finds the-det-proteins proteins-dobj-synthisize it-nsubj-attaches attaches-relcl-proteins on-prep-attaches to-prep-on the-det-ribosome ribosome-pobj-to for-mark-read it-nsubj-read to-aux-read read-advcl-attaches the-det-sequance codon-compound-sequance sequance-dobj-read it-nsubj-contians contians-relcl-sequance .-punct-finds a-det-codone codone-nsubj-is is-ROOT-is a-det-sequence sequence-attr-is of-prep-sequence three-nummod-molacuole molacuole-pobj-of of-prep-molacuole nueclear-amod-acid acid-pobj-of that-nsubj-stand when-advmod-read read-advcl-stand stand-relcl-sequence for-prep-stand one-nummod-acid amino-compound-acid acid-pobj-for (-punct-acid amino-compound-acid- acid--appos-acid the-det-blocks building-compound-blocks blocks-appos-acid for-prep-blocks proteins-pobj-for )-punct-stand as-mark-read the-det-ribosomes ribosomes-nsubj-read read-advcl-calls the-det-sequence codon-compound-sequence sequence-dobj-read ,-punct-calls the-det-ribosome ribosome-nsubj-calls calls-advcl-is trna-dobj-calls to-aux-retrive retrive-advcl-calls the-det-acids amino-compound-acids acids-dobj-retrive it-nsubj-need need-relcl-acids to-aux-create create-xcomp-need a-det-chain protien-compound-chain chain-dobj-create .-punct-calls after-mark-made a-det-chain protein-compound-chain chain-nsubjpass-made has-aux-made been-auxpass-made made-advcl-has the-det-mrna mrna-nsubj-has has-ROOT-has no-det-use more-amod-use use-dobj-has and-cc-has it-nsubj-desolves desolves-conj-has back-advmod-desolves into-prep-back the-det-cytoplasm cytoplasm-pobj-into .-punct-desolves after-mark-synthisied the-det-chain protien-compound-chain chain-nsubjpass-synthisied has-aux-synthisied been-auxpass-synthisied fully-advmod-synthisied synthisied-advcl-sent it-nsubjpass-sent get-auxpass-sent sent-ccomp-added to-dative-sent the-det-reticulum rought-amod-reticulum endoplasmic-amod-reticulum reticulum-pobj-to to-aux-have have-advcl-sent final-amod-touches touches-dobj-have added-ROOT-added to-prep-added it-pobj-to .-punct-added after-mark-added all-predet-touches the-det-touches final-amod-touches touches-nsubjpass-added are-auxpass-added added-advcl-sent to-prep-added the-det-chain protein-compound-chain chain-pobj-to ,-punct-sent it-nsubjpass-sent is-auxpass-sent then-advmod-sent sent-ROOT-sent to-prep-sent the-det-apparatus golgi-compound-apparatus apparatus-pobj-to to-aux-prepare be-aux-prepare prepare-advcl-sent to-aux-shipped be-auxpass-shipped shipped-xcomp-prepare out-prt-shipped to-prep-shipped another-det-part part-pobj-to of-prep-part the-det-body body-pobj-of .-punct-sent after-mark-prepared the-det-apparatus golgi-compound-apparatus apparatus-nsubj-prepared has-aux-prepared prepared-advcl-sent the-det-chain protein-compound-chain chain-dobj-prepared to-aux-shipped be-auxpass-shipped shipped-relcl-chain out-prt-shipped it-nsubjpass-sent is-auxpass-sent then-advmod-sent sent-ROOT-sent to-dative-sent the-det-cell cell-compound-membrance membrance-pobj-to to-aux-exit exit-advcl-sent through-prep-exit a-det-protein protein-pobj-through channal-amod-protein .-punct-sent after-mark-exited the-det-protein protein-nsubj-exited has-aux-exited exited-advcl-shiped the-det-cell cell-dobj-exited it-nsubj-is is-auxpass-shiped shiped-ROOT-shiped off-prt-shiped else-advmod-shiped where-advmod-used in-prep-where the-det-body body-pobj-in to-aux-used be-auxpass-used used-advcl-shiped"
0,"the-det-mrna mrna-nsubj-leaves leaves-ROOT-leaves the-det-nucleus nucleus-dobj-leaves through-prep-leaves a-det-process process-pobj-through called-acl-process prophase-oprd-called ,-punct-leaves then-advmod-gets the-det-cell cell-nsubj-gets gets-conj-leaves ready-acomp-gets to-aux-dived dived-xcomp-ready with-prep-dived interphase-pobj-with ,-punct-interphase ten-nummod-starts the-det-cell cell-nsubj-starts starts-conj-leaves to-aux-seperate seperate-xcomp-starts with-prep-seperate interphase-pobj-with ,-punct-finished then-advmod-finished the-det-cell cell-nsubjpass-finished is-auxpass-finished finished-ROOT-finished seperating-xcomp-finished with-prep-seperating metaphase-pobj-with"
0,mrna-nsubj-reads reads-ROOT-reads the-det-message message-dobj-reads to-prep-message the-det-parts other-amod-parts parts-pobj-to of-prep-parts the-det-transfers cell.trna-compound-transfers transfers-pobj-of carries-conj-reads the-det-message message-dobj-carries to-prep-message the-det-parts other-amod-parts parts-pobj-to of-prep-parts the-det-cell cell-pobj-of .-punct-reads
0,mrna-nsubj-sends sends-ROOT-sends the-det-message message-dobj-sends to-prep-sends the-det-ribosome ribosome-pobj-to so-mark-knows the-det-ribosome ribosome-nsubj-knows knows-advcl-sends what-det-codons codons-nsubj-make to-aux-make make-ccomp-knows for-prep-make the-det-proteins proteins-pobj-for so-mark-made the-det-proteins right-amod-proteins proteins-nsubjpass-made are-auxpass-made made-advcl-knows .-punct-sends  -nsubjpass-sent the-det-proteins proteins-nsubjpass-sent are-auxpass-sent then-advmod-sent sent-ROOT-sent to-prep-sent the-det-areas areas-pobj-to of-prep-areas the-det-body body-pobj-of that-mark-needed they-nsubjpass-needed are-auxpass-needed needed-relcl-areas in-prep-needed .-punct-sent
0,"the-det-mrna mrna-nsubj-brings brings-ROOT-brings the-det-information information-dobj-brings to-prep-brings the-det-trna. trna.-pobj-to the-det-trna trna-nsubj-transports transports-ROOT-transports the-det-codons codons-dobj-transports to-prep-transports the-det-mitochondrion mitochondrion-pobj-to .-punct-transports the-det-mitochondrion mitochondrion-nsubj-synthesizes synthesizes-ROOT-synthesizes the-det-proteins proteins-dobj-synthesizes ,-punct-synthesizes and-cc-synthesizes the-det-trna trna-nsubj-transports transports-conj-synthesizes the-det-proteins proteins-dobj-transports to-prep-transports where-advmod-need they-nsubj-need need-pcomp-to to-aux-go go-xcomp-need .-punct-transports"
0,the-det-step first-amod-step step-nsubj-is is-ROOT-is anaphase-attr-is .-punct-is which-dobj-is that-nsubj-is is-ROOT-is still-advmod-is in-prep-is it-nsubj-'s 's-advcl-is nucleus-attr-'s .-punct-'s the-det-step second-amod-step step-nsubj-is is-ROOT-is prophase-attr-is .-punct-is which-nsubj-starting that-nsubj-starting is-aux-starting starting-ROOT-starting to-aux-split split-xcomp-starting into-prep-split two-nummod-cells different-amod-cells cells-pobj-into .-punct-starting the-det-step third-amod-step step-nsubj-is is-ROOT-is telephase-attr-is .-punct-is which-nsubj-is is-ROOT-is were-ccomp-is they-nsubj-split split-ccomp-were apart-advmod-split .-punct-is the-det-step fourth-amod-step step-nsubj-is is-ROOT-is metaphase-attr-is .-punct-is which-nsubj-is is-ROOT-is were-ccomp-is the-det-cells cells-nsubj-are are-conj-is apart-advmod-are and-cc-are at-prep-are on-pcomp-at there-expl-own own-pobj-on .-punct-are
0,"first-advmod-leave they-nsubj-leave leave-advcl-copy the-det-body body-dobj-leave ,-punct-copy then-advmod-copy copy-ROOT-copy themselves-dobj-copy ,-punct-copy then-advmod-transfer transfer-conj-copy ,-punct-make last-amod-make they-nsubj-make make-dep-transfer a-det-strand new-amod-strand strand-dobj-make"
1,"after-prep-are leaving-pcomp-after the-det-nucleus nucleus-dobj-leaving there-expl-are are-ROOT-are a-det-steps few-amod-steps steps-attr-are in-prep-steps protein-compound-synthesis synthesis-pobj-in .-punct-are  -advmod-enters mrna-nsubj-enters enters-ROOT-enters the-det-ribosome ribosome-dobj-enters and-cc-enters prepares-conj-enters for-prep-prepares transcription-pobj-for .-punct-enters  -ROOT-  in-prep-binds transcription-pobj-in the-det-enzyme enzyme-dobj-transcription ,-punct-binds rna-compound-polymerase polymerase-nsubj-binds binds-ROOT-binds to-prep-binds dna-pobj-to and-cc-binds splits-conj-binds the-det-strands two-nummod-strands strands-dobj-splits apart-advmod-splits .-punct-binds  -ROOT-  it-nsubj-uses then-advmod-uses uses-ROOT-uses one-nummod-strand strand-dobj-uses as-prep-uses a-det-template template-pobj-as for-prep-template nucleotides-pobj-for to-aux-form form-xcomp-uses a-det-strand strand-dobj-form of-prep-strand rna.-pobj-of  -advcl-uses then-advmod-has it-nsubj-has has-ROOT-has to-aux-go go-xcomp-has into-prep-go translation-pobj-into .-punct-has  -advmod-used mrna-nsubjpass-used is-auxpass-used used-ROOT-used as-prep-used instructions-pobj-as for-prep-instructions decoding-pobj-for .-punct-has  -ROOT-  the-det-ribosome ribosome-nsubj-is is-ROOT-is what-nsubj-makes makes-ccomp-is the-det-protein protein-dobj-makes .-punct-is"
1,1-meta-created .-punct-1 )-punct-1 transcription--compound-codes where-compound-codes trna-compound-codes codes-ROOT-codes for-prep-codes a-det-acid certain-amod-acid amino-compound-acid acid-pobj-for .-punct-2 2-ROOT-2 .-punct-2 )-punct-1 the-det-acid amino-compound-acid acid-nsubjpass-created is-auxpass-created created-ROOT-created according-prep-created to-prep-according what-det-for.3 the-det-trna trna-nsubj-coded coded-amod-for.3 for.3-pobj-to .-punct-created )-punct-created the-det-sequence sequence-nsubjpass-held is-auxpass-held held-ROOT-held together-advmod-held by-agent-held peptide-compound-bonds.4 bonds.4-pobj-by .-punct-held )-punct-held the-det-sequence amino-compound-sequence acid-compound-sequence sequence-nsubjpass-taken is-auxpass-taken taken-ROOT-taken back-prt-taken by-agent-taken the-det-mrna mrna-pobj-by
1,"first-advmod-leaves the-det-mrna mrna-nsubj-leaves leaves-ROOT-leaves the-det-nucleus nucleus-dobj-leaves after-mark-transcribed it-nsubjpass-transcribed got-auxpass-transcribed transcribed-advcl-nucleus from-prep-transcribed half-pobj-from of-prep-half a-det-strand strand-pobj-of of-prep-strand dna.-pobj-of the-det-ribosomes small-amod-ribosomes and-cc-small large-conj-small ribosomes-nsubj-attach then-advmod-attach attach-ROOT-attach to-prep-attach the-det-rna rna-pobj-to to-aux-translate translate-advcl-attach it-dobj-translate .-punct-attach the-det-codons codons-nsubjpass-translated get-auxpass-translated translated-ROOT-translated to-prep-translated an-det-acid amino-amod-acid acid-pobj-to ,-punct-translated and-cc-translated the-det-ribosomes small-amod-ribosomes and-cc-small large-conj-small ribosomes-nsubj-pull pull-conj-translated the-det-acid needed-amod-acid amino-compound-acid acid-dobj-pull over-prt-pull and-cc-pull go-conj-pull to-prep-go the-det-codon next-amod-codon codon-pobj-to .-punct-pull they-nsubj-do do-ROOT-do this-dobj-do until-mark-have they-nsubj-have have-advcl-do a-det-strand long-amod-strand strand-dobj-have of-prep-strand amino-amod-acids acids-pobj-of to-aux-make make-advcl-have a-det-protein protein-dobj-make .-punct-do"
0,"mrna-nsubj-goes goes-ROOT-goes into-prep-goes translation-pobj-into were-advcl-goes the-det-protiens protiens-nsubj-move move-acomp-were .-punct-goes then-advmod-were trna-expl-were were-ROOT-were it-nsubj-were unzips-attr-were .-punct-were then-advmod-were were-ROOT-were it-nsubjpass-moved is-auxpass-moved moved-conj-were again-advmod-moved and-cc-moved ,-punct-zips then-advmod-zips it-nsubj-zips zips-conj-moved up-prt-zips again-advmod-zips .-punct-zips"
